288	LAUER	And can you guarantee people that after four years of a Clinton presidency, they will be safer on the streets of San Bernardino or Boston than they are today?	0
289	CLINTON	Well, Matt, I’m going to do everything in my power to make sure that that’s the result.	0
290	CLINTON	I’m not going to, you know, promise something that I think most thinking Americans know is going to be a huge challenge, and here’s why.	0
291	CLINTON	We’ve got to have an intelligence surge.	0
292	CLINTON	We’ve got to get a lot more cooperation out of Europe, out of the Middle East.	0
293	CLINTON	We have to do a better job of not only collecting and analyzing the intelligence we do have, but distributing it much more quickly down the ladder to state and local law enforcement.	0
294	CLINTON	We also have to do a better job combating ISIS online, where they recruit, where they radicalize.	0
295	CLINTON	And I don’t think we’re doing as much as we can.	0
296	CLINTON	We need to work with Silicon Valley.	0
297	CLINTON	We need to work with our experts in our government.	0
298	CLINTON	We have got to disrupt, we have got to take them on in the arena of ideas that, unfortunately, pollute and capture the minds of vulnerable people.	0
299	CLINTON	So we need to wage this war against ISIS from the air, on the ground, and online, in cyberspace.	0
300	CLINTON	And here at home, for goodness’s sakes, we have to finally pass a law prohibiting people on the terrorist watch list from being able to buy a gun in the United States of America.	0
301	CLINTON	So we’ve got work to do.	0
302	CLINTON	I know we can do that work.	0
303	CLINTON	I’m meeting with a group of terror experts, counterterrorism experts.	0
304	CLINTON	But I want to just say one additional thing.	0
305	LAUER	I’ve got 30 seconds left.	0
306	CLINTON	Matt Olsen, the former director of the National Center on Counterterrorism, has a great article out today saying the last thing we need to do is to play into the hands of ISIS.	0
307	CLINTON	Going after American Muslims, defaming a Gold Star family, the family of Captain Khan, making it more difficult for us to have a coalition with Muslim majority nations…	0
308	LAUER	And we tried to have an agreement…	0
309	CLINTON	… that is not going to help us to succeed in defeating ISIS and protecting our American homeland.	0
310	LAUER	Secretary Hillary Clinton, thank you very much.	0
311	CLINTON	Thank you.	0
312	CLINTON	Thank you all.	0
313	SYSTEM	(APPLAUSE)	0
314	CLINTON	Thank you so much.	0
315	CLINTON	Too short a time.	0
316	LAUER	I know.	0
317	LAUER	We’re going to take a break.	0
318	LAUER	We’re going to have much more with her competitor, Donald Trump, right after this.	0
319	LAUER	You’re watching NBC News special, the Commander-in-Chief Forum.	0
320	SYSTEM	(COMMERCIAL BREAK)	0
321	LAUER	We welcome you back now to this NBC News special, the Commander-in-Chief Forum.	0
322	LAUER	Tonight we’re speaking with the two major party presidential nominees to find out where they stand on the critical issues.	0
323	LAUER	Now, please welcome the Republican nominee for president, Donald Trump.	0
324	SYSTEM	(APPLAUSE)	0
325	LAUER	Good to see you.	0
326	TRUMP	Thank you, Matt.	0
327	LAUER	Thank you very much for joining us.	0
328	TRUMP	Thank you.	0
329	LAUER	You heard me say to Mrs. Clinton, Secretary Clinton, and it didn’t completely work out toward the end there, as much as possible I’d like you to tell our veterans and our people at home why you are prepared for the role of commander-in-chief and try to keep the attacks to a minimum.	0
330	LAUER	We’ve had a year of that and maybe 60 more days of it.	0
331	TRUMP	To a minimum, absolutely.	0
332	LAUER	OK, perfect.	0
333	LAUER	To a minimum.	0
334	LAUER	I guess that’s a question of definition.	0
335	TRUMP	I guess.	0
336	LAUER	Any time you interview a president, sitting or past president, they will tell you that the most daunting…	0
337	TRUMP	Was I supposed to answer this question?	0
338	LAUER	No, no, no, I mean just keep the attacks to a minimum.	0
339	LAUER	Any time you talk to a president, they’ll tell you the most daunting part of the job is the role of commander-in-chief.	0
340	TRUMP	Right.	0
341	LAUER	What have you experienced in your personal life or your professional life that you believe prepares you to make the decisions that a commander-in-chief has to make?	0
342	TRUMP	Well, I’ve built a great company.	0
343	TRUMP	I’ve been all over the world.	0
344	TRUMP	I’ve dealt with foreign countries.	0
345	TRUMP	I’ve done very well, as an example, tremendously well dealing with China and dealing with so many of the countries that are just ripping this country.	0
346	TRUMP	They are just taking advantage of us like nobody’s ever seen before.	0
347	TRUMP	And I’ve had great experience dealing on an international basis.	0
348	TRUMP	I look today and I see Russian planes circling our planes.	0
349	TRUMP	They’re taunting us.	0
350	TRUMP	I see in Iran, I see the boats taunting our ships, our destroyers, and I think…	0
351	SYSTEM	(CROSSTALK)	0
352	LAUER	But what have you done in your life that prepares you to send men and women of the United States into harm’s way?	0
353	TRUMP	Well, I think the main thing is I have great judgment.	0
354	TRUMP	I have good judgment.	0
355	TRUMP	I know what’s going on.	0
356	TRUMP	I’ve called so many of the shots.	0
357	TRUMP	And I happened to hear Hillary Clinton say that I was not against the war in Iraq.	0
358	TRUMP	I was totally against the war in Iraq.	1
359	TRUMP	From a — you can look at Esquire magazine from ’04.	0
360	TRUMP	You can look at before that.	0
361	TRUMP	And I was against the war in Iraq because I said it’s going to totally destabilize the Middle East, which it has.	0
362	TRUMP	It has absolutely been a disastrous war, and by the way, perhaps almost as bad was the way Barack Obama got out.	0
363	TRUMP	That was a disaster.	0
364	LAUER	People talk about you and commander-in-chief, and not just Secretary Clinton, but some of your Republican opponents in the primary season, and they wonder about your temperament.	0
365	LAUER	They say, does Donald Trump have the temperament to be commander-in-chief?	0
366	LAUER	You said something recently that I found interesting.	0
367	LAUER	You admitted that sometimes in the heat of a debate or when you’re talking about a lot of issues you say things that you later regret.	0
368	LAUER	So can we afford that with a commander-in-chief — to have a commander-in-chief who says things that he later regrets?	0
369	TRUMP	Well, when you say regret, yeah, sure, I regret.	0
370	TRUMP	But in the meantime, I beat 16 people and here I am.	0
371	TRUMP	So, you know, to a certain extent there is a regret.	0
372	TRUMP	I would have liked to have done it in a nicer manner.	0
373	TRUMP	But I had 16 very talented people that I had to go through.	0
374	TRUMP	And that was a lot of people.	0
375	LAUER	But when you say…	0
376	TRUMP	That was a record, Matt.	0
377	TRUMP	That was a record in the history of Republican politics.	0
378	TRUMP	I was able to get more votes than anybody ever has gotten in the history of Republican politics.	1
379	LAUER	But when you say inflammatory things… (CROSSTALK)	0
380	LAUER	… in a presidential campaign, it’s different than saying them when you’re commander-in-chief.	0
381	LAUER	If you say things you regret…	0
382	TRUMP	I agree with you.	0
383	LAUER	… when you’re commander-in-chief, you can spark a conflict, you can destabilize a region, you can put American lives at risk.	0
384	LAUER	Can we afford to take that risk with you?	0
385	TRUMP	Well, I think absolutely.	0
386	TRUMP	I think if you saw what happened in Mexico the other day, where I went there, I had great relationships, everything else.	0
387	TRUMP	I let them know where the United States stands.	0
388	TRUMP	I mean, we’ve been badly hurt by Mexico, both on the border and with taking all of our jobs or a big percentage of our jobs.	0
389	TRUMP	And if you look at what happened, look at the aftermath today where the people that arranged the trip in Mexico have been forced out of government.	0
390	TRUMP	That’s how well we did.	0
391	LAUER	Back in August…	0
392	TRUMP	And that’s how well we’re going to have to do, Matt.	0
393	LAUER	Back in August, when you admitted that you regret some of the things you said, you also said this.	0
394	LAUER	“I can promise you this: I will always tell you the truth.”	0
395	TRUMP	It’s true.	0
396	LAUER	So let me read some of the things you’ve said.	0
397	LAUER	“I know more about ISIS than the generals do.	0
398	LAUER	Believe me.” Was that the truth?	0
399	TRUMP	Well, the generals under Barack Obama and Hillary Clinton have not been successful.	0
400	TRUMP	ISIS…	0
401	LAUER	Do you know more about ISIS than they do?	0
402	TRUMP	I think under the leadership of Barack Obama and Hillary Clinton, the generals have been reduced to rubble.	0
403	TRUMP	They have been reduced to a point where it’s embarrassing for our country.	0
404	TRUMP	You have a force of 30,000 or so people.	0
405	TRUMP	Nobody really knows.	0
406	TRUMP	But probably 30,000 people.	0
407	TRUMP	And I can just see the great — as an example- General George Patton spinning in his grave as ISIS we can’t beat.	0
408	TRUMP	We had the greatest…	0
409	SYSTEM	(CROSSTALK)	0
410	LAUER	Yeah, you’ve said if we had MacArthur today or if we had Patton today, we would not have ISIS, that the rise of these military commanders that we have today, they come up the chain of command, and by the time they get to the top, they’re too politically correct.	0
411	LAUER	And we know that’s not a compliment coming from you.	0
412	LAUER	Have you lost faith in the military commanders?	0
413	TRUMP	I have great faith in the military.	0
414	TRUMP	I have great faith in certain of the commanders, certainly.	0
415	TRUMP	But I have no faith in Hillary Clinton or the leadership.	0
416	TRUMP	You look at what’s happened.	0
417	TRUMP	And, you know, when she comes in and starts saying, oh, I would have done this, I would have — she’s been there for 30 years.	0
418	TRUMP	I mean, we need change, Matt.	0
419	TRUMP	We have to have it, and we have to have it fast.	0
420	LAUER	Let’s go to Hallie Jackson in our crowd.	0
421	LAUER	Hallie?	0
422	JACKSON	I’m with Phillip Clay (ph), who was a public affairs officer in the Marine Corps.	0
423	JACKSON	He spent a year in Anbar province in Iraq.	0
424	JACKSON	He left the military with the rank of captain, service that inspired him to write a book.	0
425	JACKSON	He’s a Democrat, and he has this question for you, Mr. Trump.	0
426	QUESTION	Mr. Trump, over the past 15 years, a lot of U.S. troops have bled and died securing towns and provinces from Iraq to Afghanistan, only to have insurgent groups like ISIS spring back the moment we leave.	0
427	QUESTION	Now, you’ve claimed to have a secret plan to defeat ISIS.	0
428	QUESTION	But you’re hardly the first politician to promise a quick victory and a speedy homecoming.	0
429	QUESTION	So assuming we do defeat ISIS, what next?	0
430	QUESTION	What is your plan for the region to ensure that a group like them doesn’t just come back?	0
431	TRUMP	Sure.	0
432	TRUMP	I mean, part of the problem that we’ve had is we go in, we defeat somebody, and then we don’t know what we’re doing after that.	0
433	TRUMP	We lose it, like as an example, you look at Iraq, what happened, how badly that was handled.	0
434	TRUMP	And then when President Obama took over, likewise, it was a disaster.	0
435	TRUMP	It was actually somewhat stable.	0
436	TRUMP	I don’t think could ever be very stable to where we should have never gone into in the first place.	0
437	TRUMP	But he came in.	0
438	TRUMP	He said when we go out — and he took everybody out.	0
439	TRUMP	And really, ISIS was formed.	1
440	TRUMP	This was a terrible decision.	0
441	TRUMP	And frankly, we never even got a shot.	0
442	TRUMP	And if you really look at the aftermath of Iraq, Iran is going to be taking over Iraq.	0
443	TRUMP	They’ve been doing it.	0
444	TRUMP	And it’s not a pretty picture.	0
445	TRUMP	The — and I think you know — because you’ve been watching me I think for a long time — I’ve always said, shouldn’t be there, but if we’re going to get out, take the oil.	0
446	TRUMP	If we would have taken the oil, you wouldn’t have ISIS, because ISIS formed with the power and the wealth of that oil.	0
447	LAUER	How were we going to take the oil?	0
448	LAUER	How were we going to do that?	0
449	TRUMP	Just we would leave a certain group behind and you would take various sections where they have the oil.	0
450	TRUMP	They have — people don’t know this about Iraq, but they have among the largest oil reserves in the world, in the entire world.	0
451	TRUMP	And we’re the only ones, we go in, we spend $3 trillion, we lose thousands and thousands of lives, and then, Matt, what happens is, we get nothing.	0
452	TRUMP	You know, it used to be to the victor belong the spoils.	0
453	TRUMP	Now, there was no victor there, believe me.	0
454	TRUMP	There was no victor.	0
455	TRUMP	But I always said: Take the oil.	0
456	TRUMP	One of the benefits we would have had if we took the oil is ISIS would not have been able to take oil and use that oil…	0
457	LAUER	Let me stay on ISIS…	0
458	TRUMP	… to fuel themselves.	0
459	LAUER	Let me stay on ISIS.	0
460	LAUER	When we’ve met in the past and we’ve talked, you say things like I’m going to bomb the expletive out of them very quickly.	0
461	LAUER	And when people like me press you for details like that gentleman just said on what your plan is, you very often say, I’m not going to give you the details because I want to be unpredictable.	0
462	TRUMP	Absolutely.	0
463	TRUMP	The word is unpredictable.	0
464	LAUER	But yesterday, you actually told us a little bit about your plan in your speech.	0
465	LAUER	You said this.	0
466	LAUER	Quote, “We’re going to convene my top generals and they will have 30 days to submit a plan for soundly and quickly defeating ISIS.” So is the plan you’ve been hiding this whole time asking someone else for their plan?	0
467	TRUMP	No.	0
468	TRUMP	But when I do come up with a plan that I like and that perhaps agrees with mine, or maybe doesn’t — I may love what the generals come back with.	0
469	TRUMP	I will convene…	0
470	LAUER	But you have your own plan?	0
471	TRUMP	I have a plan.	0
472	TRUMP	But I want to be — I don’t want to — look.	0
473	TRUMP	I have a very substantial chance of winning.	0
474	TRUMP	Make America great again.	0
475	TRUMP	We’re going to make America great again.	0
476	TRUMP	I have a substantial chance of winning.	0
477	TRUMP	If I win, I don’t want to broadcast to the enemy exactly what my plan is.	0
478	LAUER	But you’re going to…	0
479	TRUMP	And let me tell you, if I like maybe a combination of my plan and the generals’ plan, or the generals’ plan, if I like their plan, Matt, I’m not going to call you up and say, “Matt, we have a great plan.” This is what Obama does.	0
480	TRUMP	“We’re going to leave Iraq on a certain day.”	0
481	LAUER	But you’re going to convene a panel of generals, and you’ve already said you know more about ISIS than those generals do.	0
482	TRUMP	Well, they’ll probably be different generals, to be honest with you.	0
483	TRUMP	I mean, I’m looking at the generals, today, you probably saw, I have a piece of paper here, I could show it, 88 generals and admirals endorsed me today.	0
484	SYSTEM	(CROSSTALK)	0
485	LAUER	It’s a numbers game.	0
486	LAUER	Hillary Clinton claims more numbers.	0
487	TRUMP	Well, it’s not really — it’s not — yeah, numbers.	0
488	TRUMP	People that have been losing for us for a long period of time.	0
489	TRUMP	I mean, the fact is, we have had the worst and you could even say the dumbest foreign policy.	0
490	TRUMP	Our results are so bad.	0
491	TRUMP	We would have been better off had we never, ever spent $2 in that part of the world.	0
492	LAUER	You recently — you recently received two intelligence briefings.	0
493	TRUMP	Yes, I did.	0
494	LAUER	Did anything in that briefing, without going into specifics, shock or alarm you?	0
495	TRUMP	Yes.	0
496	TRUMP	Very much so.	0
497	LAUER	Did you learn new things in that briefing?	0
498	TRUMP	First of all, I have great respect for the people that gave us the briefings.	0
499	TRUMP	We — they were terrific people.	0
500	TRUMP	They were experts on Iraq and Iran and different parts of — and Russia.	0
501	TRUMP	But, yes, there was one thing that shocked me.	0
502	TRUMP	And it just seems to me that what they said President Obama and Hillary Clinton and John Kerry, who is another total disaster, did exactly the opposite.	0
503	LAUER	Did you learn anything in that briefing — again, not going into specifics — that makes you reconsider some of the things you say you can accomplish, like defeating ISIS quickly?	0
504	TRUMP	No, I didn’t learn anything from that standpoint.	0
505	TRUMP	What I did learn is that our leadership, Barack Obama, did not follow what our experts and our truly — when they call it intelligence, it’s there for a reason — what our experts said to do.	0
506	LAUER	Hallie?	0
507	TRUMP	And I was very, very surprised.	0
508	TRUMP	In almost every instance.	0
509	TRUMP	And I could tell you.	0
510	TRUMP	I have pretty good with the body language.	0
511	TRUMP	I could tell they were not happy.	0
512	TRUMP	Our leaders did not follow what they were recommending.	0
513	LAUER	Hallie?	0
514	JACKSON	I’m with former Army Captain Sue Fulton, who was a member of the First West Point class to include women.	0
515	JACKSON	She served as a signal corps officer in Germany.	0
516	SYSTEM	(APPLAUSE)	0
517	JACKSON	She’s a Democrat, and she has this question for you, Mr. Trump.	0
518	QUESTION	Mr. Trump.	0
519	TRUMP	Hi, thank you very much.	0
520	QUESTION	Thank you.	0
521	QUESTION	Do you believe that an undocumented person who serves — who wants to serve in the U.S. armed forces deserves to stay in this country legally?	0
522	TRUMP	I think that when you serve in the armed forces, that’s a very special situation, and I could see myself working that out, absolutely.	0
523	LAUER	So she’s saying has already served in the armed forces or wants to serve, plans to serve?	0
524	QUESTION	Plans to serve.	0
525	QUESTION	Plans to serve in the armed forces.	0
526	QUESTION	As you know, under DACA, we already have people who are undocumented who are serving.	0
527	TRUMP	I think military is a very special thing.	0
528	TRUMP	If they plan on serving, if they get in, I would absolutely hold those people — now, we have to be very careful.	0
529	TRUMP	We have to vet very carefully.	0
530	TRUMP	Everybody would agree with that.	0
531	TRUMP	But the answer is, it would be a very special circumstance, yes.	0
532	TRUMP	Thank you.	0
533	LAUER	Thank you very much for your question.	0
534	LAUER	Hallie, you have another one?	0
535	JACKSON	I do.	0
536	JACKSON	Alex Gronkowski (ph) was an Army staff sergeant assigned in special operations.	0
537	JACKSON	He was stationed at Fort Bragg and was deployed to Afghanistan and other places across the Middle East.	0
538	JACKSON	He has not decided who he will vote for yet in November.	0
539	JACKSON	And you have a question for Mr. Trump.	0
540	QUESTION	I do.	0
541	QUESTION	Mr. Trump, as you know, tensions between the United States and Russia have been at the highest level since the Cold War.	0
542	QUESTION	In your first 120 days of presidency, how would you de-escalate the tensions?	0
543	QUESTION	And more importantly, what steps would you take to bring Mr. Putin and the Russian government back to negotiating table?	0
544	TRUMP	I think I would have a very good relationship with many foreign leaders.	0
545	TRUMP	I think it’s very sad, when you look at Barack Obama, as an example, lands Air Force One in China, and they don’t want to put out stairs to get off the plane.	1
546	TRUMP	And he has to use the stairs that mechanics use to get up and down to fix the plane.	0
547	TRUMP	They wouldn’t give him stairs.	0
548	TRUMP	I think it’s very sad, when he lands in Saudi Arabia, and he lands in Cuba, and there aren’t high officials to even greet him.	0
549	TRUMP	This is the first time in the history — the storied history of Air Force One.	0
550	TRUMP	I think I would have a very, very good relationship with Putin.	0
551	TRUMP	And I think I would have a very, very good relationship with Russia.	0
552	TRUMP	As I said, take a look today.	0
553	TRUMP	Take a look at what happened with their fighter jets circling one of our aircraft in a very dangerous manner.	0
554	TRUMP	Somebody said less than 10 feet away.	0
555	TRUMP	This is hostility.	0
556	TRUMP	And I saw, just two or three days ago, they looked like they were not exactly getting along, but I looked at President Obama and Putin staring at each other.	0
557	TRUMP	These were not two people that were getting along.	0
558	TRUMP	And, you know, the beautiful part of getting along, Russia wants to defeat ISIS as badly as we do.	0
559	TRUMP	If we had a relationship with Russia, wouldn’t it be wonderful if we could work on it together and knock the hell out of ISIS?	0
560	TRUMP	Wouldn’t that be a wonderful thing?	0
561	LAUER	Let me ask you about some of the things you’ve said about Vladimir Putin.	0
562	LAUER	You said, I will tell you, in terms of leadership, he’s getting an A, our president is not doing so well.	0
563	LAUER	And when referring to a comment that Putin made about you, I think he called you a brilliant leader, you said it’s always a great honor to be so nicely complimented by a man so highly respected within his country and beyond.	0
564	TRUMP	Well, he does have an 82 percent approval rating, according to the different pollsters, who, by the way, some of them are based right here.	1
565	TRUMP	Look, look…	0
566	LAUER	He’s also a guy who annexed Crimea, invaded Ukraine, supports Assad in Syria, supports Iran, is trying to undermine our influence in key regions of the world, and according to our intelligence community, probably is the main suspect for the hacking of the DNC computers…	0
567	SYSTEM	(CROSSTALK)	0
568	TRUMP	Well, nobody knows that for a fact.	0
569	TRUMP	But do you want me to start naming some of the things that President Obama does at the same time?	0
570	LAUER	But do you want to be complimented by that former KGB officer?	0
571	TRUMP	Well, I think when he calls me brilliant, I’ll take the compliment, OK?	1
572	TRUMP	The fact is, look, it’s not going to get him anywhere.	0
573	TRUMP	I’m a negotiator.	0
574	TRUMP	We’re going to take back our country.	0
575	TRUMP	You look at what’s happening to our country, you look at the depleted military.	0
576	TRUMP	You look at the fact that we’ve lost our jobs.	0
577	TRUMP	We’re losing our jobs like we’re a bunch of babies.	0
578	TRUMP	We’re going to take back our country, Matt.	0
579	TRUMP	The fact that he calls me brilliant or whatever he calls me is going to have zero impact.	0
580	LAUER	But the fact that you say you can get along with him, do you think the day…	0
581	TRUMP	I think I’d be able to get along with him.	0
582	LAUER	Do you think the day that you become president of the United States, he’s going to change his mind on some of these key issues?	0
583	TRUMP	Possibly.	0
584	TRUMP	It’s possible.	0
585	TRUMP	I don’t know, Matt.	0
586	TRUMP	It’s possible.	0
587	TRUMP	And it’s not going to have any impact.	0
588	TRUMP	If he says great things about me, I’m going to say great things about him.	0
589	TRUMP	I’ve already said, he is really very much of a leader.	0
590	TRUMP	I mean, you can say, oh, isn’t that a terrible thing — the man has very strong control over a country.	0
591	TRUMP	Now, it’s a very different system, and I don’t happen to like the system.	0
592	TRUMP	But certainly, in that system, he’s been a leader, far more than our president has been a leader.	0
593	TRUMP	We have a divided country.	0
594	TRUMP	We have a country where you have Hillary Clinton with her e-mails that nobody’s ever seen where she deletes 33,000 e-mails, and that’s after getting a subpoena from Congress.	0
595	TRUMP	If you do that in private business, you get thrown in jail.	0
596	LAUER	Hallie?	0
597	JACKSON	Steve Korea (ph), here with me, was in the Army Reserves and spent 10 months in Iraq right at the beginning of Operation Iraqi Freedom.	0
598	JACKSON	He is a Republican and has this question for you.	0
599	QUESTION	Good evening, Mr. Trump.	0
600	TRUMP	Hi.	0
601	QUESTION	I like what you say about supporting veterans and how they’re important.	0
602	QUESTION	But I haven’t heard what the actual plans are to continue that support beyond words.	0
603	QUESTION	How do you translate those words to action after you take office?	0
604	TRUMP	Well, I love that question, because I’ve been very close to the vets.	0
605	TRUMP	You see the relationship I have with the vets just by looking at the polls.	0
606	TRUMP	In fact, today a poll came out.	0
607	TRUMP	And my relationship has been very good.	0
608	TRUMP	I have a very, very powerful plan that’s on my website that you possibly saw.	0
609	TRUMP	One of the big problems is the wait time.	0
610	TRUMP	Vets are waiting six days, seven days, eight days.	0
611	TRUMP	And by the way, Hillary Clinton six months ago said the vets are being treated essentially just fine, there’s no real problem, it’s over-exaggerated.	1
612	TRUMP	She did say that.	0
613	LAUER	No, no, she went on after that and laid out a litany of problems within the V.A.	0
614	SYSTEM	(CROSSTALK)	0
615	TRUMP	Look, I mean, she made up half of the things she said about me.	0
616	TRUMP	I’m telling you, this is — she said she was satisfied with what was going on in the Veterans Administration.	0
