571	CHUCK TODD	You said, you implied that if this were a Republican president filling a conservative seat, this would go through without a problem.	0
572	CHUCK TODD	I guess my question to you is if Merrick Garland were replacing a liberal seat on the court, would you be more inclined to see this nomination and confirmation process go forward?	0
573	SEN. RON JOHNSON	No, I think what Vice President Biden said in 1992 is pretty accurate.	0
574	SEN. RON JOHNSON	In such a politicized atmosphere, with just a couple, literally eight months before an election, let the American people have a voice in choosing the direction of the Supreme Court when they're choosing the direction of the country.	0
575	CHUCK TODD	Under any circumstance?	0
576	CHUCK TODD	You don't think Supreme Court nominations should happen in a final year of a presidency in a presidential election year ever?	0
577	SEN. RON JOHNSON	I think it's pretty problematic.	0
578	SEN. RON JOHNSON	And particularly with the Judge Garland in Wisconsin here, he appears to be pretty hostile to Second Amendment rights to keep and bear arms, which would not be popular in Wisconsin.	0
579	SEN. RON JOHNSON	So I'm doing my job in protecting the Second Amendment rights of Wisconsinites by just withholding my consent.	0
580	CHUCK TODD	Alright.	0
581	CHUCK TODD	Senator Ron Johnson, Republican from Wisconsin up for reelection.	0
582	CHUCK TODD	Thanks for coming on the show, sir.	0
583	SEN. RON JOHNSON	Thanks for having me.	0
584	CHUCK TODD	You got it.	0
585	CHUCK TODD	We'll be back in 45 seconds with our endgame segment and the Democrats.	0
586	CHUCK TODD	Why can't Hillary Clinton put away Bernie Sanders?	0
587	CHUCK TODD	***COMMERCIAL BREAK***	0
588	CHUCK TODD	And we're back with endgame.	0
589	CHUCK TODD	I want you to listen to something Bernie Sanders said Thursday.	0
590	SYSTEM	(BEGIN TAPE)	0
591	BERNIE SANDERS	We have won six out of the last seven caucuses.	0
592	BERNIE SANDERS	Most of them by landslide victories.	0
593	BERNIE SANDERS	And I think that, uh, superdelegates should listen to the will of their people.	0
594	BERNIE SANDERS	If you get 60, 70, 80 percent of the vote in a state, you know what, I think superdelegates should vote for us.	0
595	SYSTEM	(END TAPE)	0
596	CHUCK TODD	Okay.	0
597	CHUCK TODD	So we decided to crunch the numbers on that basis to see how much it would benefit Senator Sanders, if all of the superdelegates in states he's won so far chose him.	0
598	CHUCK TODD	So take a look.	0
599	CHUCK TODD	Right now, looking at states where people have voted so far, the current superdelegate count in those states is Clinton, with 253 versus Sanders with just 25 superdelegates, with some superdelegates still undecided.	0
600	CHUCK TODD	If those superdelegates vote the way their states have voted so far, then they would divide this way: Clinton would actually increase her lead a little bit, increase her total to 260, Bernie Sanders would get to 124, because some of those undecideds that were in there would be allocated to help Hillary Clinton.	0
601	CHUCK TODD	But those numbers just show you, Hillary Clinton still would lead with superdelegates too.	0
602	CHUCK TODD	He doesn't have a path, does he?	0
603	AMY WALTER	No.	0
604	AMY WALTER	Look, this race is, it's still going on, and it's important for Hillary Clinton to remain engaged.	0
605	AMY WALTER	And I give Bernie Sanders a lot of credit from starting from zero and getting to where he is right now.	0
606	AMY WALTER	It's an impressive-- and he's made this debate about his issues and he's made her fight on his turf.	0
607	AMY WALTER	That said, the delegate math is not going to add up and it's not working.	0
608	AMY WALTER	But when you compare where Democrats are to where Republicans are, Democrats are having a skirmish right now.	0
609	AMY WALTER	Republicans are in thermonuclear war, okay?	0
610	AMY WALTER	It is not-- so it's a little bit messy, and so it's going to be a little harder for her, and maybe it's not over until June.	0
611	AMY WALTER	But they are going to be united, Democratic partisans right now like Bernie Sanders as much as they like Hillary Clinton.	0
612	AMY WALTER	They are not going to have a problem unifying the party in the way Republicans are.	0
613	CHUCK TODD	Look, David-- go ahead.	0
614	CHARLES BENSON	Alright, let me just say.	0
615	CHARLES BENSON	I think Wisconsin's going to be good for Bernie Sanders.	0
616	CHARLES BENSON	He's expected to win there.	0
617	CHARLES BENSON	This is not going to be 2008 though for Hillary Clinton where she got clobbered by double digits.	0
618	CHARLES BENSON	This could be a single-digit win.	0
619	CHARLES BENSON	But everybody knows that Bernie Sanders needs a big win.	0
620	CHARLES BENSON	And you talked about April 5th, 1960, John F. Kennedy, you know, coming out of Wisconsin, getting some legitimacy.	0
621	CHARLES BENSON	But think about it, April 5th, 1910, Wisconsin, I should say Milwaukee, was the first major American city, key word there major American, to have and elect a socialist mayor.	0
622	CHARLES BENSON	They've done it three times.	0
623	CHARLES BENSON	So that's good news.	0
624	CHUCK TODD	For Bernie Sanders.	0
625	CHARLES BENSON	For Bernie Sanders.	0
626	CHUCK TODD	Former socialist mayor of Burlington .	0
627	CHUCK TODD	But David, why--	0
628	DAVID BROOKS	I think he voted in that election.	0
629	CHUCK TODD	Oh, come on.	0
630	CHUCK TODD	Boy, you are just going to make everybody mad, aren't you?	0
631	CHUCK TODD	But Hillary Clinton is struggling to close out this nomination.	0
632	CHUCK TODD	Let's call it what it is.	0
633	CHUCK TODD	She is struggling to do it.	0
634	CHUCK TODD	Amy's right.	0
635	CHUCK TODD	It is a skirmish.	0
636	CHUCK TODD	It is not this-- but if there wasn't a Republican fight, we'd be going, "What's going on here?	0
637	CHUCK TODD	Why can't she close the deal?"	0
638	DAVID BROOKS	If Donald Trump didn't exist, we would all be talking about how she is the most unpopular nominee in recent American history.	0
639	CHUCK TODD	She would be that, instead Donald Trump is that.	0
640	DAVID BROOKS	There happens to be this other guy.	0
641	DAVID BROOKS	What strikes me is there are two motivations for voters.	0
642	DAVID BROOKS	There's philosophy, and Sanders sort of has that.	0
643	DAVID BROOKS	But there's also party loyalty.	0
644	DAVID BROOKS	I was watching your interview with her earlier.	0
645	DAVID BROOKS	And I was thinking, "If Ed Muskie or Hubert Humphrey came back and they saw her, they'd thought, “That's what a Democratic candidate looks like.'"	0
646	CHUCK TODD	Or-- and sounds like.	0
647	DAVID BROOKS	Yeah.	0
648	DAVID BROOKS	And so she's part of the party, the embodied history of the party.	0
649	DAVID BROOKS	And so there's a machine-like quality, it's hard to get super excited by her, but there's a comfort level for Democratic voters.	0
650	DAVID BROOKS	And that's carrying her, but it doesn't inspire.	0
651	HELENE COOPER	I was also struck though during your interview with Hillary, with Senator Clinton, on your questions about abortion.	0
652	HELENE COOPER	And you guys spent a lot of time during that interview, about four to five minutes.	0
653	CHUCK TODD	It's something you don't do very often with Democratic candidates.	0
654	HELENE COOPER	No, you don't.	0
655	HELENE COOPER	But she answered you and she went back and she had history and she had precedent to cite, and she talked about third world, uh, other countries she went through.	0
656	HELENE COOPER	And then I started imagining you doing that interview with Donald Trump.	0
657	HELENE COOPER	And where he gets that, when he's with Chris Matthews, and he gets that deer-with-his-eyes-caught look in his face, where you see he's grappling for an answer and he's out of his depth and he's not sure how he's going to answer it.	0
658	HELENE COOPER	And I think what this week and what happened with Donald Trump played the beneficiary of this the most I think is Hillary Clinton.	0
659	HELENE COOPER	Because if ever there was, like, you had, like, a sort of, an edging out the differences between candidates, she's the one who I think is the winner.	0
660	CHUCK TODD	But I wonder, the more clarity, it's funny.	0
661	CHUCK TODD	I agree.	0
662	CHUCK TODD	This week, this was the first time you thought, "Boy, she could really--" you could see how she's going to match up pretty well with Donald Trump.	0
663	CHUCK TODD	Republican delegates are going to see that Amy, right?	0
664	AMY WALTER	Well, they haven't seen it yet.	0
665	CHUCK TODD	Right, but they're gonna--	0
666	AMY WALTER	This is really the most fascinating thing.	0
667	AMY WALTER	There have been polls out now for a long time that showed that he has problems with women.	0
668	AMY WALTER	That shows that he has problems with pretty much every single demographic group.	0
669	AMY WALTER	And yet--	0
670	CHUCK TODD	Except white men.	0
671	AMY WALTER	Except for white men.	0
672	AMY WALTER	And yet, it has not impacted him in these primaries.	0
673	AMY WALTER	In fact, I went back and I looked at this point in 2012, almost 40 percent of Republicans said beating Obama was their top priority and they voted for Mitt Romney.	0
674	AMY WALTER	Today, 13 percent of Republicans say that electability is their top issue.	0
675	AMY WALTER	It's not about beating Hillary Clinton.	0
676	AMY WALTER	It is about putting the candidate that they think represents their values better.	0
677	AMY WALTER	And that's where Trump and Cruz fit the bill.	0
678	HELENE COOPER	But this is how they ended up losing in 2012.	0
679	HELENE COOPER	That's how we get back to, now we're moving towards a general election.	0
680	HELENE COOPER	Now we're starting, you know, what we've seen so far are these two, these two, in these two, primaries the people on the left and the people on right.	0
681	CHUCK TODD	Charles, let me ask you this, you get the final comment on this.	0
682	CHUCK TODD	Who's going to have an easier time coming together, this sort of a polarized Democratic electorate in Wisconsin or a polarized Republican electorate in Wisconsin?	0
683	CHARLES BENSON	I think the Democrats have an easier time coming together.	0
684	CHARLES BENSON	You know, they both are looking pretty good, Bernie Sanders, Hillary Clinton, and I think at the end of the day, we saw it last night.	0
685	CHARLES BENSON	They had the founders party for the Democrats.	0
686	CHARLES BENSON	You could have called it the unity party-- the unity, uh--	0
687	CHUCK TODD	They didn't fight that much?	0
688	CHARLES BENSON	They really didn't fight that much.	0
689	CHARLES BENSON	So I think they'll be able to come together.	0
690	CHUCK TODD	All right, thank you all.	0
691	CHUCK TODD	Charles, thanks for coming down.	0
692	CHARLES BENSON	Thank you for having me.	0
693	CHUCK TODD	You've got to get out of here, because I know, you've got some more work to do.	0
694	CHUCK TODD	That's all we have for today.	0
695	CHUCK TODD	We'll be back next week.	0
696	CHUCK TODD	Because as you know, if it's Sunday, it's Meet the Press.	0
