292	REINCE PRIEBUS	If there's one interviewer that probably knows the rules better than anyone, it's you, Chuck.	0
293	REINCE PRIEBUS	But I'll answer the question anyway.	0
294	CHUCK TODD	Well, you know what I mean.	0
295	CHUCK TODD	But the principle of it.	0
296	CHUCK TODD	The principle.	0
297	REINCE PRIEBUS	Yeah, no, I understand.	0
298	CHUCK TODD	Is it the party's voters that are picking this nominee or the party's delegates, which is a different set of people?	0
299	REINCE PRIEBUS	The nomination is won on the floor in Cleveland by the majority of delegates that get empowered and by the vote of the people.	0
300	REINCE PRIEBUS	So the voters in these states, their votes end up causing delegates to be bound to candidates, and those delegates will have to vote for those candidates on the floor.	0
301	REINCE PRIEBUS	There's no way around it.	0
302	REINCE PRIEBUS	If a delegate is bound to a candidate, even if that delegate decides later, "I don't care, I'm not voting for that person," the secretary at the convention will read the roll as if that delegate voted for the person that they're bound to, period.	0
303	CHUCK TODD	You know, one of the things that I think has been a misconception is that somehow, the rules of 2012 will apply to the 2016 election.	0
304	CHUCK TODD	And the reason this comes up is because there was a rule in 2012 that said if you didn't win a majority of delegates in eight states, you couldn't get your name put into nomination.	0
305	CHUCK TODD	What is the likelihood that that rule stays for 2016?	0
306	CHUCK TODD	Or are all the rules for how this election conducted going to get rewritten come July?	0
307	REINCE PRIEBUS	Well, I'm of course guessing here.	0
308	REINCE PRIEBUS	I don't have any power to change any rules, Chuck.	0
309	REINCE PRIEBUS	But I think it's probably unlikely that you see major changes.	0
310	REINCE PRIEBUS	But again, as you say, the 2012 rules were written by the 2012 delegates who were bound to Mitt Romney.	0
311	REINCE PRIEBUS	And so Mitt Romney's rules of 2012 will not be the rules that apply to the 2016 convention, which will be made largely of Trump and Cruz delegates.	0
312	REINCE PRIEBUS	And why would people want the Romney delegates' rules to apply to Cruz and Trump and Kasich?	0
313	REINCE PRIEBUS	It doesn't make any sense.	0
314	REINCE PRIEBUS	So the rules committee will come together.	0
315	REINCE PRIEBUS	Those delegates will get on these committees, they'll review the rules, and the 2016 rules will apply to the 2016 conventions.	0
316	CHUCK TODD	Is it fair, you know, the Trump campaign is not happy with what happened in Tennessee this weekend.	0
317	CHUCK TODD	It's a state primary he won, he still has the same amount of delegates that he won, 33, but he didn't get to choose the individuals, the state party did.	0
318	CHUCK TODD	And in fact, his senior advisor in his campaign told this to us, he said, "I've been told two of the delegates are truly Trump delegates.	0
319	CHUCK TODD	Five are pretend delegates."	0
320	CHUCK TODD	Meaning these are people that will be bound for two ballots, but don't plan on support him.	0
321	CHUCK TODD	Is that fair?	0
322	CHUCK TODD	Is that fair?	0
323	REINCE PRIEBUS	Well, first of all, the delegates, there's two parts of the process.	0
324	REINCE PRIEBUS	One is you've got to get the delegate allocation, meaning when you win the state, you're allocated a certain amount of delegates.	0
325	REINCE PRIEBUS	Donald Trump has 33 delegates in Tennessee.	0
326	REINCE PRIEBUS	And they're bound to Donald Trump, not just for one vote, but in Tennessee, they're actually bound for two votes.	0
327	REINCE PRIEBUS	And nothing can change that.	0
328	REINCE PRIEBUS	Now, the selection of delegates, who's in those seats is something that happens at the state party level and these campaigns have to have serious operations in the states, and they have to make sure that those people do their best job in getting their own, the people they want, to be in those seats.	0
329	REINCE PRIEBUS	So it doesn't just happen automatically.	0
330	REINCE PRIEBUS	It has to be done through work and preparation.	0
331	CHUCK TODD	Are you confident Donald Trump can win a general election?	0
332	REINCE PRIEBUS	Sure, I think all of our candidates can win a general election, especially when you look at Hillary Clinton--	0
333	CHUCK TODD	Is he your best candidate?	0
334	REINCE PRIEBUS	--who quite possibly could be indicted, and who knows.	0
335	REINCE PRIEBUS	They're the ones that could have an open convention, and Joe Biden could be the nominee of the Democratic party.	0
336	CHUCK TODD	But is Donald Trump your strongest candidate?	0
337	REINCE PRIEBUS	I don't know.	0
338	REINCE PRIEBUS	Listen, I don't worry about who is the strongest candidate.	0
339	REINCE PRIEBUS	Obviously, we have our own conversations here.	0
340	REINCE PRIEBUS	But the fact is that we're here, prepared to support whoever the eventual nominee is, with the biggest, best Republican National Committee that we've ever put together, Chuck.	0
341	CHUCK TODD	And one last question.	0
342	CHUCK TODD	Considering we're going to have an open convention, you have three candidates fighting for delegates and worried about who those people are.	0
343	CHUCK TODD	Should the RNC be in charge of the V.P.	0
344	CHUCK TODD	running mate vetting process, considering that everything is going to get scrambling.	0
345	CHUCK TODD	Have you offered to provide those services to the candidate?	0
346	REINCE PRIEBUS	You know, not particularly.	0
347	REINCE PRIEBUS	I mean, we certainly are equipped with our research team to do it.	0
348	REINCE PRIEBUS	But that's another interesting question.	0
349	REINCE PRIEBUS	Because the delegates choose the vice president as well.	0
350	REINCE PRIEBUS	And that's a subject no one's really talking about, is that that's another vote on the floor that the delegates choose.	0
351	REINCE PRIEBUS	And so while I'm sure, obviously, the choice of whoever the nominee is going to be important, it's still up for a vote of the delegates.	0
352	CHUCK TODD	Well, all that means is more reasons to watch what happens in Cleveland.	0
353	CHUCK TODD	Reince Priebus, chairman of the RNC, thanks for coming on the show, sir.	0
354	RICHARD "REINCE" PRIEBUS	Thanks.	0
355	CHUCK TODD	Appreciate it.	0
356	CHUCK TODD	Later in the broadcast, why many Republicans fear Donald Trump might not only lose the race for the White House, but could cost them their Senate majority as well.	0
357	CHUCK TODD	And our friends at S.N.L.	0
358	CHUCK TODD	had some funlast night with Trump saying a woman should be punished for having an abortion.	0
359	CHUCK TODD	Take a listen.	0
360	SYSTEM	(BEGIN TAPE)	0
361	MICHAEL CHE	You don't say that on TV.	0
362	MICHAEL CHE	Even if you're on Wheel of Fortune and the board says, "Women should be ‘unished,’ " don't say it.	0
363	SYSTEM	(END TAPE)	0
364	MICHAEL CHE	*** COMMERCIAL BREAK ***	0
365	CHUCK TODD	Welcome back.	0
366	CHUCK TODD	This Tuesday's Wisconsin primary could be one of the most influential of the campaign season.	0
367	CHUCK TODD	And it's not the first time the Badger State has been so important in presidential politics.	0
368	CHUCK TODD	In fact, ever wonder how we got into this whole presidential primary process in the first place?	0
369	CHUCK TODD	It's all thanks to Wisconsin, the very first state to come up with the idea of a presidential primary, which votes this Tuesday.	0
370	CHUCK TODD	But it wasn't until April, 1960, that the importance of the Wisconsin primary first came into play.	0
371	CHUCK TODD	In fact, here was Meet the Press that week.	0
372	CHUCK TODD	In fact, 56 years ago today, with moderator Ned Brooks.	0
373	SYSTEM	(BEGIN TAPE)	0
374	NED BROOKS	This week, the eyes of the nation will be fastened on Wisconsin's presidential primary.	0
375	NED BROOKS	Two Democratic senators, Hubert Humphrey of Minnesota, and John Kennedy of Massachusetts are competing in the first, and perhaps the most important, contested primary of 1960.	0
376	SYSTEM	(END TAPE)	0
377	CHUCK TODD	Interestingly Kennedy and Humphrey watched the election returns together in the Milwaukee Journal newsroom.	0
378	SYSTEM	(BEGIN TAPE)	0
379	MALE REPORTER	How have the votes in thus far shaped up according to your expectations?	0
380	PRES. JOHN F. KENNEDY	Well, I was hopeful we could take six districts and I think we had a good chance to do that.	0
381	PRES. JOHN F. KENNEDY	Which will give us--I hope--win the majority of the popular vote, which would give us the result.	0
382	SYSTEM	(END TAPE)	0
383	CHUCK TODD	And look at that, talking about district delegates.	0
384	CHUCK TODD	Anyway, Kennedy would win that night on his path to the nomination, and eventually the presidency.	0
385	CHUCK TODD	Let's then jump ahead to 1976, with contested primaries in both parties.	0
386	CHUCK TODD	President Gerald Ford beat Ronald Reagan handily in Wisconsin, no doubt thanks to this photo op two days prior, with Green Bay Packers quarterback Bart Starr, Go Pack Go.	0
387	CHUCK TODD	But the real race was on the Democratic side.	0
388	CHUCK TODD	Jimmy Carter versus Mo Udall.	0
389	CHUCK TODD	That evening, it looked like Udall had squeaked by Carter.	0
390	SYSTEM	(BEGIN TAPE)	0
391	MO UDALL	And let me tell you, I've finished second, and tonight I finished first.	0
392	MO UDALL	And I like first a lot better.	0
393	SYSTEM	(END TAPE)	0
394	CHUCK TODD	But as more votes came in overnight, Carter took the lead, and the networks reversed their calls, giving Carter his very own "Dewey defeats Truman" moment.	0
395	CHUCK TODD	The next day, Mo Udall told reporters, "You know all those times I said 'win' last night?	0
396	CHUCK TODD	Well, strike that and insert the word lose."	0
397	CHUCK TODD	As always with Mo Udall, he always had a sense of humor no matter what the result.	0
398	CHUCK TODD	So what will the Badger State hold in store for us this week?	0
399	CHUCK TODD	It's going to be a fun one.	0
400	CHUCK TODD	But here's what we do know.	0
401	CHUCK TODD	It's going to be influential.	0
402	CHUCK TODD	When we come back, Republicans are increasingly worried that Donald Trump could take the party down with him.	0
403	CHUCK TODD	What are the chances that they could take the nomination away from him first?	0
404	CHUCK TODD	***COMMERCIAL BREAK***	0
405	CHUCK TODD	Panel is here.	0
406	CHUCK TODD	It is Wisconsin primary week.	0
407	CHUCK TODD	So we flew in one of the smartest reporters from the state, Charles Benson from our local affiliate there, WTMJ in Milwaukee.	0
408	CHUCK TODD	Helene Cooper, Pentagon correspondent for The New York Times is also here, Amy Walter, editor of The Cook Political Report, and David Brooks, columnist for The New York Times, welcome all.	0
409	CHUCK TODD	Charles, I'll start with you.	0
410	CHUCK TODD	On the ground, is this looking as bad for Trump as the polls say it is?	0
411	CHARLES BENSON	Well, clearly he had a bad week.	0
412	CHARLES BENSON	But the anti-Trump forces were already going at him.	0
413	CHARLES BENSON	You know, they knew that they were going to come into Wisconsin and make Wisconsin their Waterloo.	0
414	CHARLES BENSON	But what they found out when they got there, the ground troops were already there, especially with conservative talk radio.	0
415	CHARLES BENSON	I mean, they have been hammering him locally, local conservative talk radio been hammering him for weeks.	0
416	CHARLES BENSON	But also, you have to keep in mind, Scott Walker, Paul Ryan, alright?	0
417	CHARLES BENSON	Scott Walker's endorsed Ted Cruz, Paul Ryan hasn't endorsed anybody.	0
418	CHARLES BENSON	But clearly, those two guys, their brand of politics has been really big time conservative issues.	0
419	CHUCK TODD	And they've won.	0
420	CHARLES BENSON	And they've won.	0
421	CHUCK TODD	So they have something to be happy about in Wisconsin.	0
422	CHARLES BENSON	They do.	0
423	CHARLES BENSON	And so they, when they look at that brand of politics, that works better than what the Trump brand of politics is right now.	0
424	CHUCK TODD	All right, David.	0
425	CHUCK TODD	We've been here, I want to say four weeks ago you were convinced Trump wasn't going to get the nomination.	0
426	CHUCK TODD	Two weeks ago, you wanted to say you were convinced, but you weren't comfortable saying anything.	0
427	CHUCK TODD	Where are you today?	0
428	DAVID BROOKS	Morally defeated.	0
429	CHUCK TODD	Something's changed though.	0
430	CHUCK TODD	Something has changed, we think?	0
431	DAVID BROOKS	Yeah something has changed.	0
432	DAVID BROOKS	All these people keep waiting for him, "When is he going to turn into a philosopher king?	0
433	DAVID BROOKS	It’s time he should become Abraham Lincoln."	0
434	DAVID BROOKS	He's Donald Trump.	0
435	DAVID BROOKS	You know, he’s - you know, it's all aggression, it's all ignorance, it's all the time.	0
436	DAVID BROOKS	But I think he's going to have a bad week this week.	0
437	DAVID BROOKS	I think he'll probably rally in New York, and it'll all come down to California.	0
438	DAVID BROOKS	The people in the Republican party are not going to stop him.	0
439	DAVID BROOKS	Look at that Reince Priebus' interview today.	0
440	DAVID BROOKS	Like, the week that we had with Donald Trump, he's a catastrophe of the party.	0
441	DAVID BROOKS	Priebus is off in la la land, talking about technical stuff, and not really seizing the mantle.	0
442	DAVID BROOKS	That's where the Republican establishment.	0
443	DAVID BROOKS	So they're not going to beat him.	0
444	DAVID BROOKS	The only way he gets beat is if he internally collapses and if his supporters morally collapse because of bad defeats in places like California and New York.	0
445	DAVID BROOKS	They're like Oklahoma at the end of the Villanova game, there's nothing there.	0
446	DAVID BROOKS	But nobody's going to take it away from him.	0
447	CHUCK TODD	Do you think David's right?	0
448	CHUCK TODD	Or I feel as if though something changed.	0
449	CHUCK TODD	I mean, you look at what's happening on the ground, in the technical parts of this, right, where you have Tennessee party chair making sure he's putting party operatives into the delegate spots, even in the Trump seats, that they're at least seeding this so that they can stop Trump if they have the opportunity.	0
450	AMY WALTER	Here's where Republicans are right now.	0
451	AMY WALTER	They get to decide if they wanna have a civil war if Trump wins, or a civil war if Trump loses.	0
452	AMY WALTER	There is no winner out of this whole fight.	0
453	AMY WALTER	So he can either come into Cleveland with the amount of delegates.	0
454	AMY WALTER	I think Wisconsin will tell us whether or not he will be able to get 1,237.	0
455	AMY WALTER	He loses Wisconsin by a big amount, I don't think he's going to be able to make that up.	0
456	AMY WALTER	Or he’ll be very close.	0
457	AMY WALTER	Or we go to Cleveland and we have another civil war where yeah, technically, they could take it away from him.	0
458	AMY WALTER	This is how it works.	0
459	AMY WALTER	Reince isn’t incorrect.	0
460	AMY WALTER	The delegates select who the president is.	0
461	AMY WALTER	But there are going to be a whole bunch of Republicans very upset about it, even people who didn't vote for Donald Trump, because they see, as you pointed out, is this fair?	0
462	AMY WALTER	Is this fair?	0
463	AMY WALTER	And that is going to just split this party apart.	0
464	AMY WALTER	And anybody who thinks that Donald Trump is just going to go away if he loses this like, "Oh, well, he's not going to be able to get on a ballot," he's got Twitter and he's got cable TV.	0
465	AMY WALTER	And he's going to spend all of his time there.	0
466	CHUCK TODD	Helene, I'm curious.	0
467	CHUCK TODD	You know, he's talked a lot about NATO this week in weird ways, he's talked a lot about nukes and nuclear policy.	0
468	CHUCK TODD	I'm just curious, what do the folks at the Pentagon think?	0
469	CHUCK TODD	And I'm not talking about the political operatives, I'm talking about the career folks who are going to be there if Trump's elected president or if Clinton's elected president.	0
470	HELENE COOPER	No, they were appalled.	0
471	HELENE COOPER	You know, last week, I was on a Navy cruiser in the South China Sea that was doing this diplomatic dance with China.	0
472	HELENE COOPER	We had a Chinese ship that was trailing us.	0
473	HELENE COOPER	And several times, I got into conversations with sailors about, you know, "This is all about how we, you know, how we strategize in a really important area, could Donald Trump even handle something like this?"	0
474	HELENE COOPER	And then you had this week, with Donald Trump's message is about, and what he said about South Korea and Japan, which the Japanese prime minister immediately recanted, or dismissed.	0
475	HELENE COOPER	But, and you have that juxtaposed against President Obama's Washington Nuclear Summit, in which you had heads of states from all over the world sitting here, carefully talking about nuclear disarmament and how do we go about doing it.	0
476	HELENE COOPER	I just think when you look at all of the things that happened to Donald Trump this week, and the abortion issue was horrible for him, but I think the nuclear issue, I think, ends up scaring people particularly at the Pentagon and the national security apparatus a whole lot more.	0
477	CHUCK TODD	All right.	0
478	CHUCK TODD	If Trump falls though, the beneficiary is Ted Cruz.	0
479	CHUCK TODD	Ted Cruz, if Ted Cruz wins Wisconsin, Charles, is it because there are a whole bunch of Cruz Republicans, or is he really benefiting from Stop Trump right now?	0
480	CHARLES BENSON	Well, I think he's benefiting from the Stop Trump right now.	0
481	CHARLES BENSON	Clearly, it's getting late to get to the dance, and they were looking for a dance partner, and Ted Cruz was the guy.	0
482	CHUCK TODD	Yeah, why Cruz and not Kasich though?	0
483	CHUCK TODD	Some of us would have thought Kasich might fit this state better.	0
484	CHARLES BENSON	Right when you look at the match-up from Kasich, you would think he would match what the conservative brand would be in Wisconsin.	0
485	CHARLES BENSON	I mean, Wisconsin's pretty conservative right now.	0
486	CHARLES BENSON	They’ve got the conservative governor, got a conservative legislature, they control both houses.	0
487	CHARLES BENSON	And they have a conservative high court.	0
488	CHARLES BENSON	He got the backing Kasich of the former governor, Tommy Thompson, who has won there four times.	0
489	CHARLES BENSON	But I think they felt that Cruz, when they were looking at the difference between Cruz and Kasich, they were saying, "Who can beat Trump?	0
490	CHARLES BENSON	How can we get to the convention with a guy?"	0
491	CHARLES BENSON	And they felt Ted Cruz was the guy.	0
492	CHUCK TODD	David Brooks, what do you most likely think is going to happen now?	0
493	CHUCK TODD	Is it Trump, Cruz, or Paul Ryan?	0
494	DAVID BROOKS	I think it's likely to be Trump.	0
495	DAVID BROOKS	I think he's the walking dead.	0
496	DAVID BROOKS	I think he'll get the nomination and he will just go down to a crushing defeat.	0
497	DAVID BROOKS	And will be known for a hundred years from now, people will say, "Who's the biggest loser in American politics?"	0
498	DAVID BROOKS	And it won't be McGovern, it won't be Dukakis, the word Trump.	0
499	DAVID BROOKS	And I hope when he's down there in Hades he's aware of all that.	0
500	CHUCK TODD	Wow.	0
501	HELENE COOPER	Very subtle.	0
502	CHUCK TODD	Very subtle.	0
503	CHUCK TODD	Why do I have a feeling Mr. Brooks is going to hear from Mr. Trump sometime on social media today?	0
504	CHUCK TODD	Anyway, with that, we'll take a pause.	0
505	CHUCK TODD	When we come back, down ballot blues.	0
506	CHUCK TODD	We're going to stick with Wisconsin as a theme.	0
507	CHUCK TODD	What does Donald Trump at the top of the ticket mean for Republicans further down?	0
508	CHUCK TODD	We'll be right back.	0
509	CHUCK TODD	***COMMERCIAL BREAK***	0
510	CHUCK TODD	Welcome back.	0
511	CHUCK TODD	One of the reasons the Republican establishment has the jitters over Donald Trump is the worry that having Trump at the top of the ticket will hurt the party's chances of keeping control of the house and the Senate.	0
512	CHUCK TODD	My next guest, Wisconsin Senator Ron Johnson is up for reelection in November and does face a tough fight to hold onto his seat in a swing state that has gone blue more often than not.	0
513	CHUCK TODD	Senator Johnson, welcome back to Meet the Press.	0
514	SEN. RON JOHNSON	Morning, Chuck.	0
515	SEN. RON JOHNSON	How are you doing?	0
516	CHUCK TODD	I'm pretty good.	0
517	CHUCK TODD	Let me ask you straight up.	0
518	CHUCK TODD	Are you going to say who you're voting for on Tuesday?	0
519	CHUCK TODD	Are you going to endorse before Tuesday?	0
520	SEN. RON JOHNSON	I have not endorsed.	0
521	SEN. RON JOHNSON	You know, I've certainly stated my intention to support whoever the Republican nominee is.	0
522	SEN. RON JOHNSON	I've got to have faith in Wisconsin primary voters as well as American - or the Republican primary voters on a national level.	0
523	SEN. RON JOHNSON	So that's my intention.	0
524	CHUCK TODD	It's interesting you put it that way.	0
525	CHUCK TODD	Do you plan on supporting the candidate who wins the primary on Tuesday in Wisconsin?	0
526	CHUCK TODD	Do you think that's the most appropriate action?	0
527	SEN. RON JOHNSON	Well, again, what I will do is I will support whoever the delegates in the national convention actually chooses for a nominee.	0
528	SEN. RON JOHNSON	And we've got three and a half months to go here before that's actually determined.	0
529	SEN. RON JOHNSON	You know, three and a half months is a lifetime in politics.	0
530	SEN. RON JOHNSON	So nobody can predict exactly how this is going to turn out.	0
531	CHUCK TODD	You know, you’ve been - it's been surprising to hear from you as compared to some of your other fellow Republican senators who are running for reelection in swing states.	0
532	CHUCK TODD	You're one of the few that says publicly that you think Donald Trump helps you in your reelection, that he doesn't hurt you.	0
533	CHUCK TODD	Why?	0
534	SEN. RON JOHNSON	No.	0
535	SEN. RON JOHNSON	I think what I've been talking about is, you know, from my standpoint, I'm a businessperson.	0
536	SEN. RON JOHNSON	I'm a completely outsider.	0
537	SEN. RON JOHNSON	And that certainly is what has resonated about his campaign in many respects.	0
538	SEN. RON JOHNSON	But, you know, from my standpoint, I think what this campaign ought to be about is, you know, growth.	0
539	SEN. RON JOHNSON	How do you grow our economy?	0
540	SEN. RON JOHNSON	It's the number one component for a solution.	0
541	SEN. RON JOHNSON	I think what candidates are finding out here in Wisconsin is we have some very discerning primary voters here on the Republican side.	0
542	SEN. RON JOHNSON	And like Charles mentioned, a lot has to do with our exceptional talk radio hosts across the state.	0
543	SEN. RON JOHNSON	And I think some of the candidates found out exactly exceptional they really are in terms of asking tough questions.	0
544	SEN. RON JOHNSON	And that's really what elections are about, and sort of primaries about, is getting out the truth.	0
545	CHUCK TODD	All right.	0
546	CHUCK TODD	Senator, by saying what you said, you're all but implying you're not for Trump.	0
547	CHUCK TODD	You're all but implying by essentially praising how great these conservative radio can be, how do we not interpret that as an anti-Trump sentiment coming from you?	0
548	SEN. RON JOHNSON	Because I'm saying what I'm saying.	0
549	SEN. RON JOHNSON	I'm not endorsing somebody.	0
550	SEN. RON JOHNSON	That obviously speaks for itself.	0
551	SEN. RON JOHNSON	The last primary, I did endorse Mitt Romney, and I'll tell you why I endorsed Mitt Romney, it's why I met with him beforehand, he said, "Ron, I expect to be a one-term president, because I'm going to fix these problems."	0
552	SEN. RON JOHNSON	And then when he picked Paul Ryan as a running mate, it just confirmed that my choice was correct.	0
553	SEN. RON JOHNSON	So obviously, I don't have a comfort level.	0
554	SEN. RON JOHNSON	You know, let's face it.	0
555	SEN. RON JOHNSON	No two people agree on everything.	0
556	SEN. RON JOHNSON	I'll tell you what, though, is certain, is I will never vote for Hillary Clinton or Bernie Sanders or whoever the Democrat nominee may be.	0
557	SEN. RON JOHNSON	So again, I'm looking, and I've got to put my faith and trust in Republican primary voters, and I intend to support the Republican nominee, whoever that person may or may not be.	0
558	CHUCK TODD	Let me ask you this.	0
559	CHUCK TODD	What advice would you give Donald Trump to improve his chances in Wisconsin?	0
560	CHUCK TODD	Right now, we've got polling that shows he trails Hillary Clinton by ten points.	0
561	CHUCK TODD	Ted Cruz and Hillary Clinton are tied in Wisconsin.	0
562	CHUCK TODD	And John Kasich actually leads her.	0
563	CHUCK TODD	But if Trump's the nominee, what advice would you give Donald Trump to improve his standing in Wisconsin?	0
564	SEN. RON JOHNSON	It's the same advice I'd give anybody in a primary or a general election.	0
565	SEN. RON JOHNSON	Show your vision for America, for Wisconsin, and certainly in a Republican primary, show the primary voters how you intend to take that vision to defeat the Democratic nominee.	0
566	SEN. RON JOHNSON	Let's face it, we're going to be facing either a socialist, I think we should all remember that socialism isn't hasn't worked.	0
567	SEN. RON JOHNSON	Not in the Soviet Union, not in Venezuela, certainly not in what should be the island paradise of Cuba.	0
568	SEN. RON JOHNSON	And Hillary Clinton has so much baggage, you know, she's going to be a very flawed candidate if she ends up being selected.	0
569	CHUCK TODD	Alright, final question.	0
570	CHUCK TODD	Merrick Garland, the President's choice for the Supreme Court vacancy, you said something interesting.	0
