1	Donald Trump	Thank you, Phoenix.	0
187	Donald Trump	Whether it's dangerous materials being smuggled across the border, terrorists entering on visas, or Americans losing their jobs to foreign workers, these are the problems we must now focus on fixing -- and the media needs to begin demanding to hear Hillary Clinton's answer on how her policies will affect Americans and their security.	0
188	Donald Trump	These are matters of life-and-death for our country and its people, and we deserve answers from Hillary Clinton.	0
189	Donald Trump	What we do know, despite the total lack of media curiosity, is that Hillary Clinton promises a radical amnesty combined with a radical reduction in immigration enforcement.	0
190	Donald Trump	The result will be millions more illegal immigrants, thousands more violent crimes, and total chaos and lawlessness.	0
191	Donald Trump	This election is our last chance to secure the border, stop illegal immigration, and reform our laws to make your life better.	0
192	Donald Trump	This is it.	0
193	Donald Trump	We won't get another opportunity -- it will be too late.	0
194	Donald Trump	So I want to remind everyone what we are fighting for -- and who we are fighting for.	0
195	Donald Trump	So I am going to ask all the Angel Moms to come join me on the stage right now.	0
196	SYSTEM	[[PAUSE FOR ANGEL MOMS -- EACH SAYS THE NAME OF THEIR CHILD INTO THE MICROPHONE]]	0
197	Donald Trump	Now is the time for these voices to be heard.	0
198	Donald Trump	Now is the time for the media to begin asking questions on their behalf.	0
199	Donald Trump	Now is the time for all of us, as one country, Democrat and Republican, liberal and conservative, to band together to deliver justice and safety and security for all Americans.	0
200	Donald Trump	Let's fix this problem.	0
201	Donald Trump	Let's secure our border.	0
202	Donald Trump	Let's stop the drugs and the crime.	0
203	Donald Trump	Let's protect our Social Security and Medicare.	0
204	Donald Trump	And let's get unemployed Americans off of welfare and back to work in their own country.	0
205	Donald Trump	Together, we can save American lives, American jobs, and American futures.	0
206	Donald Trump	Together, we can save America itself.	0
207	Donald Trump	Join me in this mission to Make America Great Again.	0
208	Donald Trump	Thank you, and God Bless you all!	0
