617	TRUMP	Now, under my plan, if you’ve got to wait — and, by the way, people are dying on line.	0
618	TRUMP	They’re dying, waiting, waiting to get to see a doctor.	0
619	TRUMP	They’re waiting five days and six days.	0
620	TRUMP	Under a part of my plan, if they have that long wait, they walk outside, they go to the local doctor, they choose the doctor, they choose the hospital, whether it’s public or private, they get themselves better.	0
621	TRUMP	In many cases, it’s a minor procedure or a pill or just a prescription.	0
622	TRUMP	And they end up dying because they can’t get to see the doctor.	0
623	TRUMP	We will pay the bill.	0
624	TRUMP	They go outside, they get a doctor, they get a prescription, they do what they have to do, and we pay the bill.	0
625	TRUMP	That is something that I have been praised — and, by the way, I never said take the V.A.	0
626	TRUMP	— take the Veterans Administration private.	0
627	TRUMP	I wouldn’t do that.	0
628	TRUMP	Too much respect for our people.	0
629	TRUMP	I would never do that.	0
630	LAUER	OK.	0
631	TRUMP	I heard it was said that I said that.	0
632	TRUMP	I would not do that.	0
633	TRUMP	But I do believe — I do believe, when you’re waiting in line for six, seven days, you should never be in a position like that.	0
634	TRUMP	You go out, you see the doctor, you get yourself taken care of.	0
635	LAUER	Hallie, you’ve got another question.	0
636	JACKSON	I do.	0
637	JACKSON	Rachel Fredericks (ph), who specialized in aviations operations in the Marine Corps, serving stateside, she lost two friends to suicide.	0
638	JACKSON	And you now struggle yourself with PTSD.	0
639	JACKSON	She’s a Republican, but leaning towards you, still undecided a little bit.	0
640	JACKSON	Rachel, you have a question for Mr. Trump.	0
641	QUESTION	I do.	0
642	QUESTION	Mr. Trump, I wanted to ask what your plan will be to stop 20 veterans a day from killing themselves.	0
643	TRUMP	And actually it’s 22.	0
644	TRUMP	And it’s almost impossible to conceive that this is happening in our country, 20 to 22 people a day are killing themselves.	0
645	TRUMP	A lot of it is they’re killing themselves over the fact that they can’t — they’re under tremendous pain and they can’t see a doctor.	0
646	TRUMP	We’re going to speed up the process.	0
647	TRUMP	We’re going to create a great mental health division.	0
648	TRUMP	They need help.	0
649	TRUMP	They need help.	0
650	TRUMP	They need tremendous help.	0
651	TRUMP	And we’re doing nothing for them.	0
652	TRUMP	The V.A.	0
653	TRUMP	is really almost, you could say, a corrupt enterprise.	0
654	TRUMP	If you look at what’s going on, as an example, Matt, in Arizona, where they caught people stealing, and they can’t even do anything about it, they can’t even fire the people.	0
655	TRUMP	So we are going to make it efficient and good.	0
656	TRUMP	And if it’s not good, you’re going out to private hospitals, public hospitals, and doctors.	0
657	TRUMP	Thank you very much.	0
658	LAUER	Hallie, one more?	0
659	JACKSON	Donald Day (ph) here, who served as a radio operator in the Marine Corps in the Vietnam era.	0
660	JACKSON	He had tours of duty in Southeast Asia and in Europe.	0
661	JACKSON	He’s also a Democrat and has this question for you.	0
662	QUESTION	Mr. Trump, I have a daughter who is interested in joining the service, but when she researched the military, she saw the stats on sexual assault and decided not to go.	0
663	QUESTION	I have a concern about the rape of women in our armed forces.	0
664	QUESTION	As president, what specifically would you do to support all victims of sexual assault in the military?	0
665	TRUMP	It’s a great question.	0
666	TRUMP	And it’s a massive problem.	0
667	TRUMP	The numbers are staggering, hard to believe, even.	0
668	TRUMP	But we’re going to have to run it very tight.	0
669	TRUMP	I at the same time want to keep the court system within the military.	0
670	TRUMP	I don’t think it should be outside of the military.	0
671	TRUMP	But we have to come down very, very hard on that.	0
672	TRUMP	And your daughter is absolutely right, it is a massive problem.	0
673	TRUMP	But we have to do something about that problem.	0
674	TRUMP	And the best thing we can do is set up a court system within the military.	0
675	TRUMP	Right now, the court system practically doesn’t exist.	0
676	TRUMP	It takes too long.	0
677	LAUER	In 2013, on this subject, you tweeted this, quote, “26,000 unreported sexual assaults in the military, only 238 convictions.	0
678	LAUER	What did these geniuses expect when they put men and women together?”	0
679	TRUMP	Well, it is — it is — it is a correct tweet.	0
680	TRUMP	There are many people that think that that’s absolutely correct.	0
681	TRUMP	And we need to have a…	0
682	SYSTEM	(CROSSTALK)	0
683	LAUER	So this should have been expected?	0
684	LAUER	And does that mean the only way to fix it is to take women out of the military?	0
685	TRUMP	Well, it’s happening, right?	0
686	TRUMP	And, by the way, since then, it’s gotten worse.	0
687	TRUMP	No, not to take them out, but something has to be happen.	0
688	TRUMP	Right now, part of the problem is nobody gets prosecuted.	0
689	TRUMP	You have reported and — the gentleman can tell you, you have the report of rape and nobody gets prosecuted.	0
690	TRUMP	There are no consequence.	0
691	TRUMP	When you have somebody that does something so evil, so bad as that, there has to be consequence for that person.	0
692	TRUMP	You have to go after that person.	0
693	TRUMP	Right now, nobody’s doing anything.	0
694	TRUMP	Look at the small number of results.	0
695	TRUMP	I mean, that’s part of the problem.	0
696	LAUER	So many of the issues that we’ve talked about with you, Mr. Trump, tonight, and Secretary Clinton, are so complex that even career military people and career diplomats and politicians have trouble getting their arms around them.	0
697	TRUMP	Right.	0
698	LAUER	You’ve had a very different background, in business.	0
699	LAUER	So nobody would expect you to have taken over the last 20 years really deep dives into some of these issues.	0
700	LAUER	But I’m curious about what you’re doing now.	0
701	LAUER	What kind of research are you doing now?	0
702	LAUER	What kind of homework are you doing?	0
703	LAUER	What kind of things are you reading as you prepare for the day in two months where you might be elected the next president of the United States?	0
704	TRUMP	Sure.	0
705	TRUMP	Well, in the front row, you have four generals.	0
706	TRUMP	You have admirals.	0
707	TRUMP	We have people all throughout the audience that I’m dealing with.	0
708	TRUMP	Right here is a list that was just printed today of 88 admirals and generals that I meet with and I talk to.	0
709	LAUER	How much time are you spending on this?	0
710	TRUMP	I’m also — a lot.	0
711	TRUMP	A lot.	0
712	TRUMP	And I’m doing a lot of different things.	0
713	TRUMP	Don’t forget, we’re running a big campaign.	0
714	TRUMP	We’re doing very well.	0
715	TRUMP	I’m also, you know, and I’m very much giving it to my children and my executives to run, I’m also partially running a business.	0
716	TRUMP	I’m campaigning, I’m running a business.	0
717	TRUMP	I’ve got a lot of hats right now.	0
718	TRUMP	But we’re doing very well.	0
719	TRUMP	But in the meantime, I am studying.	0
720	TRUMP	And I’m meeting constantly — you see — you see General Flynn and you see some of the folks that we have, and they’re scattered throughout the audience.	0
721	TRUMP	So we have admirals, we have generals, we have colonels.	0
722	TRUMP	We have a lot of people that I respect.	0
723	TRUMP	And I think I’ve learned a lot.	0
724	TRUMP	But I think, also, I certainly — I really feel I have a common sense on the various issues that you’re talking about, Matt.	0
725	LAUER	You said in the speech today, you said history shows that when America is not prepared is when the danger is the greatest.	0
726	TRUMP	And we’re not prepared.	0
727	LAUER	Will you be prepared on day one, if you’re elected president of the United States, to tackle these complex national security issues?	0
728	TRUMP	One hundred percent.	0
729	TRUMP	Hey, Matt, again, she made a mistake on Libya.	0
730	TRUMP	She made a terrible mistake on Libya.	0
731	TRUMP	And the next thing, I mean, not only did she make the mistake, but then they complicated the mistake by having no management once they bombed you know what out of Gadhafi.	0
732	TRUMP	I mean, she made a terrible mistake on Libya.	0
733	TRUMP	And part of it was the management aftereffect.	0
734	TRUMP	I think that we have great management talents, great management skills.	0
735	LAUER	But you are prepared?	0
736	TRUMP	And I have to tell you — totally prepared.	0
737	TRUMP	But remember this.	0
738	TRUMP	I found this subject and these subjects of interest all of my life, Matt.	0
739	TRUMP	This hasn’t been over the last 14 months.	0
740	TRUMP	I’ve found these substantiates of tremendous interest.	0
741	TRUMP	That’s why they were asking me about Iraq 14 years ago.	0
742	TRUMP	They were asking me these questions.	0
743	TRUMP	They don’t ask businesspeople those questions.	0
744	LAUER	Let me end in kind of the same place I started.	0
745	LAUER	Have you given much thought, Mr. Trump, if you’re elected president and commander-in-chief, to that moment where you’re going to have to make that first decision that puts American men and women in harm’s way?	0
746	TRUMP	I think it’s the most difficult decision you can possibly ever make.	0
747	TRUMP	You’re talking about death.	0
748	TRUMP	And we’re talking death to not just our side.	0
749	TRUMP	We’re talking death all over.	0
750	TRUMP	I would be very, very cautious.	0
751	TRUMP	I think I’d be a lot slower.	0
752	TRUMP	She has a happy trigger.	0
753	TRUMP	You look, she votes for the wars, she goes in Libya…	0
754	SYSTEM	(CROSSTALK)	0
755	LAUER	Have you thought about personally the emotional burden of that moment?	0
756	TRUMP	I think it’s a tremendous burden.	0
757	TRUMP	I think there is no greater burden that anybody could have.	0
758	TRUMP	I’ve been preparing this for a long time.	0
759	TRUMP	And, you know, my theme is make America great again.	0
760	TRUMP	We’re going to make America great again.	0
761	TRUMP	But, Matt, we’ve also got to make America strong again.	0
762	TRUMP	And right now, we are not strong.	0
763	TRUMP	Believe me.	0
764	TRUMP	We have a depleted military.	0
765	TRUMP	We have the greatest people in the world in our military.	0
766	TRUMP	But it is very sadly depleted.	0
767	LAUER	The Republican nominee for president of the United States, Donald Trump.	0
768	TRUMP	Thank you, Matt.	0
769	LAUER	Thank you.	0
770	SYSTEM	(APPLAUSE)	0
771	LAUER	We’re going to be much — we’ll be back with much more from the Intrepid carrier on this Commander-in-Chief Forum right after this.	0
772	SYSTEM	(COMMERCIAL BREAK)	0
773	LAUER	There’s a lot of people we want to thank for making tonight a success, the presidential nominees themselves, Hillary Clinton and Donald Trump.	0
774	LAUER	We want to thank the many veterans in our audience for their questions and, most importantly, for their service.	0
775	LAUER	We want to thank our hosts at the IAVA, the Iraq and Afghanistan Veterans of America, and, of course, the Intrepid Sea, Air, and Space Museum, this amazing venue.	0
776	LAUER	The first presidential debate will be held on September 26th right here on NBC.	0
777	LAUER	It’ll be hosted by my colleague, Lester Holt.	0
778	LAUER	We hope you’ll tune in for that.	0
779	LAUER	And more importantly, we hope you get out and vote this November.	0
780	LAUER	Nothing could be more important.	0
781	LAUER	Thank you for joining us tonight.	0
782	LAUER	For Matt Lauer — I’m Matt Lauer.	0
783	LAUER	For all of us at NBC News, we appreciate your tuning in.	0
784	SYSTEM	(APPLAUSE)	0
