689	Donald Trump	No, I just said that.	0
690	Donald Trump	No, I, what'd I say, I stopped watching them.	0
691	Donald Trump	But I don't watch CNN anymore.	0
692	Donald Trump	I don't watch MSNBC.	0
693	Donald Trump	I don't watch it.	0
694	Donald Trump	Now I heard yesterday that MSNBC, you know, they tell me what's going on.	0
695	Julie Pace	Right.	0
696	Donald Trump	In fact, they also did.	0
697	Donald Trump	I never thought I had the ability to not watch.	0
698	Donald Trump	Like, people think I watch "Morning Joe."	0
699	Donald Trump	I don't watch "Morning Joe."	0
700	Donald Trump	I never thought I had the ability to, and who used to treat me great by the way, when I played the game.	0
701	Donald Trump	I never thought I had the ability to not watch what is unpleasant, if it's about me.	0
702	Donald Trump	Or pleasant.	0
703	Donald Trump	But when I see it's such false reporting and such bad reporting and false reporting that I've developed an ability that I never thought I had.	0
704	Donald Trump	I don't watch things that are unpleasant.	0
705	Donald Trump	I just don't watch them.	0
706	Julie Pace	And do you feel like that's, that's because of the office that you now occupy --	0
707	Donald Trump	No.	0
708	Julie Pace	That you've made that change?	0
709	Donald Trump	I don't know why it is, but I've developed that ability, and it's happened over the last, over the last year.	0
710	Julie Pace	That's interesting.	0
711	Donald Trump	And I don't watch things that I know are going to be unpleasant.	0
712	Donald Trump	CNN has covered me unfairly and incorrectly and I don't watch them anymore.	0
713	Donald Trump	A lot of people don't watch them anymore, they're now in third place.	0
714	Donald Trump	But I've created something where people are watching... but I don't watch CNN anymore.	0
715	Donald Trump	I don't watch MSNBC anymore.	0
716	Donald Trump	I don't watch things, and I never thought I had that ability.	0
717	Donald Trump	I always thought I'd watch.	0
718	Julie Pace	Sure.	0
719	Donald Trump	I just don't.	0
720	Donald Trump	And that's taken place over the last year.	0
721	Donald Trump	And you know what that is, that's a great, it's a great thing because you leave, you leave for work in the morning you know, you're, you don't watch this total negativity.	0
722	Donald Trump	I never thought I'd be able to do that and for me, it's so easy to do now.	0
723	Donald Trump	Just don't watch.	0
724	Julie Pace	That's interesting.	0
725	Donald Trump	Maybe it's because I'm here.	0
726	Donald Trump	I don't know.	0
