1	Julie Pace	I do want to talk to you about the 100 days.	0
2	Donald Trump	Good.	0
3	Julie Pace	I want to ask a few questions on some topics that are happening toward the end of the interview. Did you see Aya	0
4	SYSTEM	[Hijazi, an Egyptian-American charity worker who had been detained in the country for nearly three years]	0
5	Julie Pace	...	0
6	Julie Pace	Can you tell me a little bit about how that came about?	0
7	Donald Trump	No, just -- you know, I asked the government to let her out...	0
8	Donald Trump	You know Obama worked on it for three years, got zippo, zero.	0
9	Julie Pace	How did you hear about this story?	0
10	Donald Trump	Many people, human rights people, are talking about it.	0
11	Donald Trump	It's an incredible thing, especially when you meet her.	0
12	Donald Trump	You realize -- I mean, she was in a rough place. Did you have to strike a deal with	0
13	SYSTEM	[Abdel-Fattah]	0
14	Donald Trump	el-Sissi over this?	0
15	Donald Trump	No.	0
16	Donald Trump	No deal.	0
17	Donald Trump	He was here.	0
18	Donald Trump	He -- I said, "I really would appreciate it if you would look into this and let her out."	0
19	Donald Trump	And as you know, she went through a trial.	0
20	Donald Trump	And anyway, she was let go.	0
21	Donald Trump	And not only she, it was a total of eight people... Yeah, it's funny: One of the best chemistries I had was with	0
22	SYSTEM	[Angela]	0
23	Donald Trump	Merkel.	0
24	Donald Trump	[Crosstalk	0
25	Julie Pace	Really?	0
26	Donald Trump	Chancellor Merkel.	0
27	Donald Trump	And I guess somebody shouted out, "Shake her hand, shake her hand," you know.	0
28	Donald Trump	But I never heard it.	0
29	Donald Trump	But I had already shaken her hand four times.	0
30	Donald Trump	You know, because we were together for a long time.	0
31	Julie Pace	Did you expect you would have good chemistry with her?	0
32	Donald Trump	No.	0
33	Donald Trump	Because, um, I'm at odds on, you know, the NATO payments and I'm at odds on immigration.	0
34	Donald Trump	We had unbelievable chemistry.	0
35	Donald Trump	And people have given me credit for having great chemistry with all of the leaders, including el-Sissi...	0
36	Donald Trump	So it was a great thing to see that happen.	0
37	Julie Pace	Do you feel like you have changed the office of the presidency, how the presidency can be used to effect change?	0
38	Donald Trump	I think the 100 days is, you know, it's an artificial barrier.	0
39	Donald Trump	It's not very meaningful.	0
40	Donald Trump	I think I've established amazing relationships that will be used the four or eight years, whatever period of time I'm here.	0
41	Donald Trump	I think for that I would be getting very high marks because I've established great relationships with countries, as President el-Sissi has shown and others have shown.	0
42	Donald Trump	Well, if you look at the president of China, people said they've never seen anything like what's going on right now.	0
43	Donald Trump	I really liked him a lot.	0
44	Donald Trump	I think he liked me.	0
45	Donald Trump	We have a great chemistry together...	0
46	Donald Trump	I've developed great relationships with all of these leaders.	0
47	Donald Trump	Nobody's written that.	0
48	Donald Trump	In fact, they said, "Oh, well, he's not treating them nicely," because on NATO, I want them to pay up.	0
49	Donald Trump	But I still get along with them great, and they will pay up.	0
50	Donald Trump	In fact, with the Italian prime minister yesterday, you saw, we were joking, "Come on, you have to pay up, you have to pay up."	0
51	Donald Trump	He'll pay.	0
52	Julie Pace	Did he say that?	0
53	Julie Pace	In your meeting?	0
54	Julie Pace	Your private meeting?	0
55	Donald Trump	He's going to end up paying.	0
56	Donald Trump	But you know, nobody ever asked the question.	0
57	Donald Trump	Nobody asked.	0
58	Donald Trump	Nobody ever asked him to pay up.	0
59	Donald Trump	So it's a different kind of a presidency.	0
60	Julie Pace	Do you feel like that's one thing that you've changed, that you maybe are actually asking the direct questions about some of these things?	0
61	Donald Trump	Yeah.	0
62	Donald Trump	Let me give me an example.	0
63	Donald Trump	A little before I took office there was a terrible article about the F-35 fighter jet.	0
64	Donald Trump	It was hundreds of billions of dollars over budget.	0
65	Donald Trump	It was seven years behind schedule.	0
66	Donald Trump	It was a disaster.	0
67	Donald Trump	So I called in Lockheed and I said, "I'm sorry, we're going to have to bid this out to another company, namely Boeing," or whoever else.	0
68	Donald Trump	But Boeing.	0
69	Donald Trump	And I called in Boeing and I started getting competing offers back and forth...	0
70	Donald Trump	I saved $725 million on the 90 planes.	1
71	Donald Trump	Just 90.	0
72	Donald Trump	Now there are 3,000 planes that are going to be ordered.	0
73	Donald Trump	On 90 planes I saved $725 million.	0
74	Donald Trump	It's actually a little bit more than that, but it's $725 million.	0
75	Donald Trump	Gen. Mattis, who had to sign the deal when it came to his office, said, "I've never seen anything like this in my life."	0
76	Donald Trump	We went from a company that wanted more money for the planes to a company that cut.	0
77	Donald Trump	And the reason they cut -- same planes, same everything -- was because of me.	0
78	Donald Trump	I mean, because that's what I do.	0
79	Donald Trump	Now if you multiply that times 3,000 planes, you know this is on 90 planes.	0
80	Donald Trump	In fact, when the Prime Minister Abe of Japan came in because they bought a certain number of those...	0
81	Donald Trump	The first thing he said to me, because it was right at the time I did it, he said, "Could I thank you?"	0
82	Donald Trump	I said, "What?"	0
83	Donald Trump	He said, "You saved us $100 million."	0
84	Donald Trump	Because they got a $100 million savings on the 10 or 12 planes that they bought.	0
85	Donald Trump	Nobody wrote that story.	0
86	Donald Trump	Now you know that's a saving of billions and billions of dollars, many billions of dollars over the course of -- it's between 2,500 and 3,000 planes will be the final order.	0
87	Donald Trump	But this was only 90 of those 2,500 planes.	0
88	Julie Pace	And you expect those savings to carry out across that full order?	0
89	Donald Trump	More.	0
90	Donald Trump	I'm gonna get more than that.	0
91	Donald Trump	This was a thing that was out of control and now it's great. And the woman that runs Lockheed, Marillyn	0
92	SYSTEM	[Hewson]	0
93	Donald Trump	, she was great.	0
94	Donald Trump	But all of a sudden it was a different kind of a thing.	0
95	Donald Trump	You know?	0
96	Julie Pace	Do you feel like you've been able to apply that kind of a relationship to your dealings with Congress as well?	0
97	Donald Trump	I have great relationships with Congress.	0
98	Donald Trump	I think we're doing very well and I think we have a great foundation for future things.	0
99	Donald Trump	We're going to be applying, I shouldn't tell you this, but we're going to be announcing, probably on Wednesday, tax reform.	0
100	Donald Trump	And it's -- we've worked on it long and hard.	0
101	Donald Trump	And you've got to understand, I've only been here now 93 days, 92 days.	0
102	Donald Trump	President Obama took 17 months to do Obamacare.	0
103	Donald Trump	I've been here 92 days but I've only been working on the health care, you know I had to get like a little bit of grounding right?	0
104	Donald Trump	Health care started after 30 day, so I've been working on health care for 60 days...You know, we're very close.	0
105	Donald Trump	And it's a great plan, you know, we have to get it approved.	0
106	Julie Pace	Is it this deal that's between the Tuesday Group and the Freedom Caucus, is that the deal you're looking at?	0
107	Donald Trump	So the Republican Party has various groups, all great people.	0
108	Donald Trump	They're great people.	0
109	Donald Trump	But some are moderate, some are very conservative.	0
110	Donald Trump	The Democrats don't seem to have that nearly as much.	0
111	Donald Trump	You know the Democrats have, they don't have that.	0
112	Donald Trump	The Republicans do have that.	0
113	Donald Trump	And I think it's fine.	0
114	Donald Trump	But you know there's a pretty vast area in there.	0
115	Donald Trump	And I have a great relationship with all of them.	0
116	Donald Trump	Now, we have government not closing.	0
117	Donald Trump	I think we'll be in great shape on that.	0
118	Donald Trump	It's going very well.	0
119	Donald Trump	Obviously, that takes precedent.	0
120	Julie Pace	That takes precedent over health care?	0
121	Julie Pace	For next week?	0
122	Donald Trump	Yeah, sure.	0
123	Donald Trump	Next week.	0
124	Donald Trump	Because the hundred days is just an artificial barrier.	0
125	Donald Trump	The press keeps talking about the hundred days.	0
126	Donald Trump	But we've done a lot.	0
127	Donald Trump	You have a list of things.	0
128	Donald Trump	I don't have to read it.	0
129	Julie Pace	You did put out though, as a candidate, you put out a 100-day plan.	0
130	Julie Pace	Do you feel like you should be held accountable to that plan?	0
131	Donald Trump	Somebody, yeah, somebody put out the concept of a hundred-day plan.	0
132	Donald Trump	But yeah.	0
133	Donald Trump	Well, I'm mostly there on most items. Go over the items, and I'll talk to you ...	0
134	SYSTEM	[Crosstalk]	0
135	Donald Trump	But things change.	0
136	Donald Trump	There has to be flexibility.	0
137	Donald Trump	Let me give you an example.	0
138	Donald Trump	President Xi, we have a, like, a really great relationship.	0
139	Donald Trump	For me to call him a currency manipulator and then say, "By the way, I'd like you to solve the North Korean problem," doesn't work.	0
140	Donald Trump	So you have to have a certain flexibility, Number One.	0
141	Donald Trump	Number Two, from the time I took office till now, you know, it's a very exact thing.	0
142	Donald Trump	It's not like generalities.	0
143	Donald Trump	Do you want a Coke or anything?	0
144	Julie Pace	I'm OK, thank you.	0
145	Julie Pace	No...	0
146	Donald Trump	But President Xi, from the time I took office, he has not, they have not been currency manipulators.	0
147	Donald Trump	Because there's a certain respect because he knew I would do something or whatever.	0
148	Donald Trump	But more importantly than him not being a currency manipulator the bigger picture, bigger than even currency manipulation, if he's helping us with North Korea, with nuclear and all of the things that go along with it, who would call, what am I going to do, say, "By the way, would you help us with North Korea?	0
149	Donald Trump	And also, you're a currency manipulator."	0
150	Donald Trump	It doesn't work that way.	0
151	Julie Pace	Right.	0
152	Donald Trump	And the media, some of them get it, in all fairness.	0
153	Donald Trump	But you know some of them either don't get it, in which case they're very stupid people, or they just don't want to say it.	0
154	Donald Trump	You know because of a couple of them said, "He didn't call them a currency manipulator."	0
155	Donald Trump	Well, for two reasons.	0
156	Donald Trump	Number One, he's not, since my time.	0
157	Donald Trump	You know, very specific formula.	0
158	Donald Trump	You would think it's like generalities, it's not.	0
159	Donald Trump	They have -- they've actually -- their currency's gone up.	0
160	Donald Trump	So it's a very, very specific formula.	0
161	Donald Trump	And I said, "How badly have they been,"... they said, "Since you got to office they have not manipulated their currency."	0
162	Donald Trump	That's Number One, but much more important, they are working with us on North Korea.	0
163	Donald Trump	Now maybe that'll work out or maybe it won't.	0
164	Donald Trump	Can you imagine?	0
165	Donald Trump	...	0
166	Julie Pace	So in terms of the 100-day plan that you did put out during the campaign, do you feel, though, that people should hold you accountable to this in terms of judging success?	0
167	Donald Trump	No, because much of the foundation's been laid.	0
168	Donald Trump	Things came up.	0
169	Donald Trump	I'll give you an example.	0
170	Donald Trump	I didn't put Supreme Court judge on the 100 day plan, and I got a Supreme Court judge.	0
171	Julie Pace	I think it's on there.	0
172	Donald Trump	I don't know...	0
173	Julie Pace	Begin the process of selecting.	0
174	Julie Pace	You actually exceeded on this one.	0
175	Julie Pace	This says, "Begin the process of selecting a replacement."	0
176	Donald Trump	That's the biggest thing I've done.	0
177	Julie Pace	Do you consider that your biggest success?	0
178	Donald Trump	Well, I -- first of all I think he's a great man.	0
179	Donald Trump	I think he will be a great, great justice of the Supreme Court.	0
180	Donald Trump	I have always heard that the selection and the affirmation of a Supreme Court judge is the biggest thing a president can do.	0
181	Donald Trump	Don't forget, he could be there for 40 years....	0
182	Donald Trump	He's a young man.	0
183	Donald Trump	I've always heard that that's the biggest thing.	0
184	Donald Trump	Now, I would say that defense is the biggest thing.	0
185	Donald Trump	You know, to be honest, there are a number of things.	0
186	Donald Trump	But I've always heard that the highest calling is the nomination of a Supreme Court justice.	0
187	Donald Trump	I've done one in my first 70 days.	0
188	Donald Trump	Our military is so proud.	0
189	Donald Trump	They were not proud at all.	0
190	Donald Trump	They had their heads down.	0
191	Donald Trump	Now they have their heads up...	0
192	Donald Trump	I'm rebuilding the military.	0
193	Donald Trump	We have great people.	0
194	Donald Trump	We have great things in place.	0
195	Donald Trump	We have tremendous borders.	0
196	Donald Trump	I mention the F-35 because if I can save $725 million -- look at that, that's a massive amount of money.	0
197	Donald Trump	And I'll save more as we make more planes. If I can save that on a small number of planes -- Gen. Mattis said, "I've never seen anything like this," because he had to sign the ultimate	0
198	SYSTEM	[Inaudible]	0
199	Donald Trump	...	0
200	Donald Trump	He had to sign the ultimate, you know.	0
201	Donald Trump	He said, "I've never seen anything like this before, as long as I've been in the military."	0
202	Donald Trump	You know, that kind of cutting.	0
203	Julie Pace	Right. Now, if I can do that	0
204	SYSTEM	[Inaudible]	0
205	Julie Pace	... As an example, the aircraft carriers, billions of dollars, the Gerald Ford, billions and billions over budget.	0
206	Donald Trump	That won't happen.	0
207	Julie Pace	Is that something you're going to take on?	0
208	SYSTEM	[Inaudible]	0
209	Julie Pace	But as we order the other ones, because they want to order 12, the other ones are going to come in much less expensive...	0
210	Julie Pace	Can I ask you, over your first 100 days -- you're not quite there yet -- how do you feel like the office has changed you?	0
211	Donald Trump	Well the one thing I would say -- and I say this to people -- I never realized how big it was. Everything's so	0
212	SYSTEM	[Inaudible]	0
213	Donald Trump	like, you know the orders are so massive.	0
214	Donald Trump	I was talking to --	0
215	Julie Pace	You mean the responsibility of it, or do you mean --	0
216	Donald Trump	Number One, there's great responsibility.	0
217	Donald Trump	When it came time to, as an example, send out the 59 missiles, the Tomahawks in Syria.	0
218	Donald Trump	I'm saying to myself, "You know, this is more than just like, 79 missiles.	0
219	Donald Trump	This is death that's involved," because people could have been killed.	0
220	Donald Trump	This is risk that's involved, because if the missile goes off and goes in a city or goes in a civilian area -- you know, the boats were hundreds of miles away -- and if this missile goes off and lands in the middle of a town or a hamlet .... every decision is much harder than you'd normally make.	0
221	SYSTEM	[Inaudible]	0
222	Donald Trump	...	0
223	Donald Trump	This is involving death and life and so many things....	0
224	Donald Trump	So it's far more responsibility.	0
225	SYSTEM	[Inaudible]	0
226	Donald Trump	....The financial cost of everything is so massive, every agency.	0
227	Donald Trump	This is thousands of times bigger, the United States, than the biggest company in the world.	0
228	Donald Trump	The second-largest company in the world is the Defense Department.	0
229	Donald Trump	The third-largest company in the world is Social Security.	0
230	Donald Trump	The fourth-largest -- you know, you go down the list.	0
231	Julie Pace	Right.	0
232	Donald Trump	It's massive.	0
233	Donald Trump	And every agency is, like, bigger than any company.	0
234	Donald Trump	So you know, I really just see the bigness of it all, but also the responsibility.	0
235	Donald Trump	And the human responsibility.	0
236	Donald Trump	You know, the human life that's involved in some of the decisions.	0
237	Julie Pace	You've talked a little bit about the way that you've brought some business skills into the office.	0
238	Julie Pace	Is there anything from your business background that just doesn't translate into the presidency, that just simply is not applicable to this job?	0
239	Donald Trump	Well in business, you don't necessarily need heart, whereas here, almost everything affects people.	0
240	Donald Trump	So if you're talking about health care -- you have health care in business but you're trying to just negotiate a good price on health care, et cetera, et cetera.	0
241	Donald Trump	You're providing health. This is	0
242	SYSTEM	[Inaudible]	0
243	Donald Trump	.	0
244	Donald Trump	Here, everything, pretty much everything you do in government, involves heart, whereas in business, most things don't involve heart.	0
245	Julie Pace	What's that switch been like for you?	0
246	Donald Trump	In fact, in business you're actually better off without it.	0
247	Julie Pace	What's making that switch been like for you?	0
248	Donald Trump	You have to love people.	0
249	Donald Trump	And if you love people, such a big responsibility.	0
250	SYSTEM	[Inaudible]	0
251	Donald Trump	You can take any single thing, including even taxes.	0
252	Donald Trump	I mean we're going to be doing major tax reform. Here's part of your story, it's going to be a big	0
253	SYSTEM	[Inaudible]	0
254	Donald Trump	.	0
255	Donald Trump	Everybody's saying, "Oh, he's delaying."	0
256	Donald Trump	I'm not delaying anything. I'll tell you the other thing is	0
257	SYSTEM	[Inaudible]	0
258	Donald Trump	.	0
259	Donald Trump	I used to get great press.	0
260	Donald Trump	I get the worst press.	0
261	Donald Trump	I get such dishonest reporting with the media.	0
262	Donald Trump	That's another thing that really has -- I've never had anything like it before.	0
263	Donald Trump	It happened during the primaries, and I said, you know, when I won, I said, "Well the one thing good is now I'll get good press."	0
264	Donald Trump	And it got worse.	0
265	SYSTEM	[Inaudible]	0
266	Donald Trump	So that was one thing that a little bit of a surprise to me.	0
267	Donald Trump	I thought the press would become better, and it actually, in my opinion, got more nasty.	0
268	Julie Pace	But in terms of tax reform, how are you going to roll that out next week?	0
269	Donald Trump	Well I'm going to roll probably on Wednesday, around Wednesday of next week, we're putting out a massive tax reform -- business and for people -- we want to do both. We've been working on it	0
270	SYSTEM	[Inaudible]	0
271	Donald Trump	.	0
272	Donald Trump	Secretary Mnuchin is a very talented person, very smart. Very successful	0
273	SYSTEM	[Inaudible]	0
274	Donald Trump	.... We're going to be putting that out on Wednesday or shortly thereafter. Let me leave a little room just in case	0
275	SYSTEM	[Inaudible]	0
276	Donald Trump	.... And that's a big story, because a lot of people think I'm going to put it out much later.	0
277	Julie Pace	Do you have any details on that in terms of rates?	0
278	Donald Trump	Only in terms that it will be a massive tax cut.	0
279	Donald Trump	It will be bigger, I believe, than any tax cut ever.	0
280	Donald Trump	Maybe the biggest tax cut we've ever had...	0
281	Julie Pace	Obviously, that's going to come in a week where you're going to be running up against the deadline for keeping the government open.	0
282	Julie Pace	If you get a bill on your desk that does not include funding for the wall, will you sign it?	0
283	Donald Trump	I don't know yet.	0
284	Donald Trump	People want the border wall.	0
285	Donald Trump	My base definitely wants the border wall, my base really wants it -- you've been to many of the rallies.	0
286	Donald Trump	OK, the thing they want more than anything is the wall.	0
287	Donald Trump	My base, which is a big base; I think my base is 45 percent.	0
288	Donald Trump	You know, it's funny.	0
289	Donald Trump	The Democrats, they have a big advantage in the electoral college.	0
290	Donald Trump	Big, big, big advantage.	0
291	Donald Trump	I've always said the popular vote would be a lot easier than the electoral college. The electoral college -- but it's a whole different campaign	0
292	SYSTEM	[Inaudible]	0
293	Donald Trump	.	0
294	Donald Trump	The electoral college is very difficult for a Republican to win, and I will tell you, the people want to see it.	0
295	Donald Trump	They want to see the wall, they want to see security.	0
296	Donald Trump	Now, it just came out that they're 73 percent down.... That's a tremendous achievement.... Look at this, in 100 days, that down to the lowest in 17 years and it's going lower.	0
297	Donald Trump	Now, people aren't coming because they know they're not going to get through, and there isn't crime.	0
298	Donald Trump	You know the migration up to the border is horrible for women, you know that?	0
299	SYSTEM	[Unintelligible]	0
300	Donald Trump	Now, much of that's stopped because they can't get through.	0
301	Julie Pace	It sounds like maybe you're beginning to send a message that if you do get a spending bill that doesn't have border funding in there, you would sign it.	0
302	Donald Trump	Well, first of all, the wall will cost much less than the numbers I'm seeing.	0
303	Donald Trump	I'm seeing numbers, I mean, this wall is not going to be that expensive.	0
304	Julie Pace	What do you think the estimate on it would be?	0
305	Donald Trump	Oh I'm seeing numbers -- $24 billion, I think I'll do it for $10 billion or less.	0
306	Donald Trump	That's not a lot of money relative to what we're talking about.	0
307	Donald Trump	If we stop 1 percent of the drugs from coming in -- and we'll stop all of it.	0
308	Donald Trump	But if we stop 1 percent of the drugs because we have the wall -- they're coming around in certain areas, but if you have a wall, they can't do it because it's a real wall.	0
309	Donald Trump	That's a tremendously good investment, 1 percent.	0
310	Donald Trump	The drugs pouring through on the southern border are unbelievable.	0
311	Donald Trump	We're becoming a drug culture, there's so much.	0
312	Donald Trump	And most of it's coming from the southern border.	0
313	Donald Trump	The wall will stop the drugs.	0
314	Julie Pace	But, just trying to nail you down on it one more time, will you sign a spending bill if it doesn't have --	0
315	Donald Trump	I don't want to comment.	0
316	Donald Trump	I just don't know yet.	0
317	Donald Trump	I mean, I have to see what's going on.	0
318	Donald Trump	I really do.	0
319	Donald Trump	But the wall's a very important thing to -- not only my base, but to the people.	0
320	Donald Trump	And even if it wasn't, I mean I'll do things that aren't necessarily popular....	0
321	Donald Trump	The wall is very important to stopping drugs.	0
322	Julie Pace	If you don't have a funding stream, your message to your base is what?	0
323	Donald Trump	My base understands the wall is going to get built, whether I have it funded here or if I get it funded shortly thereafter, that wall's getting built, OK?	0
324	Donald Trump	One hundred percent.	0
325	Donald Trump	One hundred percent it's getting built.	0
326	Donald Trump	And it's also getting built for much less money -- I hope you get this -- than these people are estimating.	0
327	Donald Trump	The opponents are talking $25 billion for the wall.	0
328	Donald Trump	It's not going to cost anywhere near that.	0
329	Julie Pace	You think $10 billion or less.	0
330	Donald Trump	I think $10 billion or less.	0
331	Donald Trump	And if I do a super-duper, higher, better, better security, everything else, maybe it goes a little bit more.	0
332	Donald Trump	But it's not going to be anywhere near those kind of numbers.	0
333	Donald Trump	And they're using those numbers; they're using the high numbers to make it sound impalatable.	0
334	Donald Trump	And the fact it's going to cost much less money, just like the airplane I told you about, which I hope you can write about.	0
335	SYSTEM	[Interview goes off the record]	0
336	Donald Trump	They had a quote from me that NATO's obsolete.	0
337	Donald Trump	But they didn't say why it was obsolete.	0
338	Donald Trump	I was on Wolf Blitzer, very fair interview, the first time I was ever asked about NATO, because I wasn't in government.	0
339	Donald Trump	People don't go around asking about NATO if I'm building a building in Manhattan, right?	0
340	Donald Trump	So they asked me, Wolf... asked me about NATO, and I said two things.	0
341	Donald Trump	NATO's obsolete -- not knowing much about NATO, now I know a lot about NATO -- NATO is obsolete, and I said, "And the reason it's obsolete is because of the fact they don't focus on terrorism."	0
342	Donald Trump	You know, back when they did NATO there was no such thing as terrorism.	0
343	Julie Pace	What specifically has NATO changed?	0
344	SYSTEM	[Citing Wall Street Journal Article]	0
345	Julie Pace	...	0
