346	Donald Trump	I did an interview with Wolf Blitzer, and I said NATO was obsolete -- I said two things -- obsolete, and the country's aren't paying.	0
347	Donald Trump	I was right about both.	0
348	Donald Trump	I took such heat for about three days on both, because nobody ever criticized NATO.	0
349	Donald Trump	I took heat like you wouldn't believe.	0
350	Donald Trump	And then some expert on NATO said, "You know, Trump is right."	0
351	Donald Trump	But I said it was obsolete because they weren't focused on terror...	0
352	Donald Trump	It's not fair that we're paying close to 4 percent and other countries that are more directly affected are paying 1 percent when they're supposed to be paying 2 percent.	0
353	Donald Trump	And I'm very strong on it and I'm going to be very strong on it when I go there in a month."	0
354	Julie Pace	This morning you tweeted that after the possible terrorist attack in Paris, that it will have a big effect on the upcoming French election.	0
355	Julie Pace	What did you mean by that?	0
356	Donald Trump	Well, I think it will have a big effect on who people are going to vote for in the election.	0
357	Julie Pace	Do you think it's going to help Marine Le Pen?	0
358	Donald Trump	I think so.	0
359	Julie Pace	Do you believe that she should be the president?	0
360	Donald Trump	No, I have no comment on that, but I think that it'll probably help her because she is the strongest on borders and she is the strongest on what's been going on in France.	0
361	Julie Pace	Do you worry at all that by saying that, that a terrorist attack would have an impact on a democratic election, that it would actually embolden terrorists to try to --.	0
362	Donald Trump	No.	0
363	Donald Trump	Look, everybody is making predictions who is going to win.	0
364	Donald Trump	I am no different than you, you could say the same thing...	0
365	Julie Pace	I just wonder if you are encouraging, you are the president of the United States, so to say that you worry that it encourages terrorists ...	0
366	Donald Trump	No, I am no different than -- no, I think it discourages terrorists, I think it discourages.	0
367	Donald Trump	I think what we've done on the border discourages it.	0
368	Donald Trump	I think that my stance on having people come in to this country that we have no idea who they are and in certain cases you will have radical Islamic terrorism.	0
369	Donald Trump	I'm not going to have it in this country.	0
370	Donald Trump	I'm not going to let what happened to France and other places happen here.	0
371	Donald Trump	And it's already largely, you know -- we have tens -- we have hundreds of thousands of people that have been allowed into our country that should not be here.	0
372	Donald Trump	They shouldn't be here.	0
373	Donald Trump	We have people allowed into our country with no documentation whatsoever.	0
374	Donald Trump	They have no documentation and they were allowed under the previous administrations, they were allowed into our country.	0
375	Donald Trump	It's a big mistake.	0
376	Julie Pace	Just so that I am clear.	0
377	Julie Pace	You are not endorsing her for the office, but you are --	0
378	Donald Trump	I am not endorsing her and I didn't mention her name.	0
379	Julie Pace	Right, I just wanted to make sure I have that clear.	0
380	Donald Trump	I believe whoever is the toughest on radical Islamic terrorism and whoever is the toughest at the borders will do well at the election.	0
381	Donald Trump	I am not saying that person is going to win, she is not even favored to win, you know.	0
382	Donald Trump	Right now, she is in second place.	0
383	Julie Pace	I have a question on the markets, actually.	0
384	Julie Pace	One thing that I think has been different about this White House is that you do point to the markets as a sign of progress.	0
385	Julie Pace	Do you worry, though -- I mean, the markets go up and down.	0
386	Donald Trump	You live by the sword, you die by the sword, to a certain extent.	0
387	Donald Trump	But we create a lot of jobs, 500,000 jobs as of two months ago, and plenty created since.	1
388	Donald Trump	Five hundred thousand.... As an example, Ford, General Motors.	0
389	Donald Trump	I've had cases where the gentleman from China, Ma, Jack Ma, he comes up, he says, "Only because of you am I making this massive investment."	0
390	Donald Trump	Intel, only because of you....	0
391	Donald Trump	The press never writes that.	0
392	Julie Pace	What about NAFTA?	0
393	Julie Pace	What's the plan on NAFTA?	0
394	Donald Trump	What would you like to know?	0
395	Julie Pace	I would like to know what your plan is in terms of renegotiating.	0
396	Donald Trump	I am very upset with NAFTA.	0
397	Donald Trump	I think NAFTA has been a catastrophic trade deal for the United States, trading agreement for the United States.	0
398	Donald Trump	It hurts us with Canada, and it hurts us with Mexico.	0
399	Donald Trump	Most people don't even think of NAFTA in terms of Canada.	0
400	Donald Trump	You saw what happened yesterday in my statements, because if you look at the dairy farmers in Wisconsin and upstate New York, they are getting killed by NAFTA.	0
401	Julie Pace	Is your plan still, though, to renegotiate the whole deal?	0
402	Donald Trump	I am going to either renegotiate it or I am going to terminate it.	0
403	Julie Pace	Termination is still on the table.	0
404	Donald Trump	Absolutely.	0
405	Donald Trump	If they don't treat fairly, I am terminating NAFTA.	0
406	Julie Pace	What's a timeline for that decision?	0
407	Donald Trump	It's a six-month termination clause, I have the right to do it, it's a six-month clause.	0
408	Julie Pace	If I could fit a couple of more topics.	0
409	Julie Pace	Jeff Sessions, your attorney general, is taking a tougher line suddenly on Julian Assange, saying that arresting him is a priority.	0
410	Julie Pace	You were supportive of what WikiLeaks was doing during the campaign with the release of the Clinton emails.	0
411	Julie Pace	Do you think that arresting Assange is a priority for the United States?	0
412	Donald Trump	When Wikileaks came out... never heard of Wikileaks, never heard of it.	1
413	Donald Trump	When Wikileaks came out, all I was just saying is, "Well, look at all this information here, this is pretty good stuff."	0
414	Donald Trump	You know, they tried to hack the Republican, the RNC, but we had good defenses.	0
415	Donald Trump	They didn't have defenses, which is pretty bad management.	0
416	Donald Trump	But we had good defenses, they tried to hack both of them.	0
417	Donald Trump	They weren't able to get through to Republicans.	0
418	Donald Trump	No, I found it very interesting when I read this stuff and I said, "Wow."	0
419	Donald Trump	It was just a figure of speech.	0
420	Donald Trump	I said, "Well, look at this.	0
421	Donald Trump	It's good reading."	0
422	Julie Pace	But that didn't mean that you supported what Assange is doing?	0
423	Donald Trump	No, I don't support or unsupport.	0
424	Donald Trump	It was just information.	0
425	Donald Trump	They shouldn't have allowed it to get out.	0
426	Donald Trump	If they had the proper defensive devices on their internet, you know, equipment, they wouldn't even allow the FBI.	0
427	Donald Trump	How about this -- they get hacked, and the FBI goes to see them, and they won't let the FBI see their server.	0
428	Donald Trump	But do you understand, nobody ever writes it. Why wouldn't	0
429	SYSTEM	[John]	0
430	Donald Trump	Podesta and Hillary Clinton allow the FBI to see the server?	0
431	Donald Trump	They brought in another company that I hear is Ukrainian-based.	0
432	Julie Pace	CrowdStrike?	0
433	Donald Trump	That's what I heard.	0
434	Donald Trump	I heard it's owned by a very rich Ukrainian, that's what I heard.	0
435	Donald Trump	But they brought in another company to investigate the server.	0
436	Donald Trump	Why didn't they allow the FBI in to investigate the server?	0
437	Donald Trump	I mean, there is so many things that nobody writes about.	0
438	Donald Trump	It's incredible.	0
439	Julie Pace	Can I just ask you, though -- do you believe it is a priority for the United States, or it should be a priority, to arrest Julian Assange?	0
440	Donald Trump	I am not involved in that decision, but if Jeff Sessions wants to do it, it's OK with me.	0
441	Donald Trump	I didn't know about that decision, but if they want to do it, it's OK with me.	0
442	Julie Pace	On Iran, which is another thing you talked a lot on the campaign --	0
443	Donald Trump	And the other thing that we should go after is the leakers...	0
444	Julie Pace	On Iran, you also talked about it quite a bit on the campaign trail.	0
445	Julie Pace	And you said in the press conference yesterday that you think that Iran is violating the spirit of the agreement.	0
446	Julie Pace	When you say that, do you mean in terms of the actual nuclear accord, or do you mean what they are doing in the region?	0
447	Donald Trump	In terms of what they are doing all over the Middle East and beyond.	0
448	Julie Pace	So you believe that they are complying with the agreement?	0
449	Donald Trump	No, I don't say that.	0
450	Donald Trump	I say that I believe they have broken the spirit of the agreement.	0
451	Donald Trump	There is a spirit to agreements, and they have broken it.	0
452	Julie Pace	In terms of what they are doing elsewhere in the Middle East?	0
453	Donald Trump	In terms of what they are doing of all over.	0
454	Julie Pace	When you talk to European leaders, when you talk to Merkel, for example, or Teresa May, what do they say about the nuclear deal?	0
455	Julie Pace	Do they want you to stay in that deal?	0
456	Donald Trump	I don't talk to them about it.	0
457	Julie Pace	You don't talk to them about the Iran deal?	0
458	Donald Trump	I mention it, but it's very personal when I talk to them, you know, it's confidential.	0
459	Donald Trump	No, they have their own opinions.	0
460	Donald Trump	I don't say that they are different than my opinions, but I'd rather have you ask them that question.	0
461	Julie Pace	At this point, do you believe that you will stay in the nuclear deal?	0
462	Donald Trump	It's possible that we won't.	0
463	Julie Pace	Dreamers, you've talked about them, you've talked about heart earlier.	0
464	Julie Pace	This is one area where you have talked --	0
465	Donald Trump	No, we aren't looking to do anything right now.	0
466	Donald Trump	Look, the dreamers... this is an interesting case, they left and they came back and he's got some problems, it's a little different than the dreamer case, right?	0
467	Donald Trump	But we are putting MS-13 in jail and getting them the hell out of our country.	0
468	Donald Trump	They've taken over towns and cities and we are being really brutal with MS-13, and that's what we should be.	0
469	Donald Trump	They are a bad group, and somebody said they are as bad as al-Qaida, which is a hell of a reference.	0
470	Donald Trump	So we are moving criminals out of our country and we are getting them out in record numbers and those are the people we are after.	0
471	Donald Trump	We are not after the dreamers, we are after the criminals.	0
472	Julie Pace	And that's going to be the policy of your administration to allow the dreamers to stay?	0
473	Donald Trump	Yes.	0
474	Donald Trump	Yes.	0
475	Donald Trump	That's our policy.	0
476	Donald Trump	I am not saying... long-term, we are going to have to fix the problem, the whole immigration problem.	0
477	Donald Trump	But I will tell you: Right now we have a great gentleman, one of my real stars is Gen. Kelly, now Secretary Kelly.	0
478	Donald Trump	We are down 73 percent at the border, we are cleaning out cities and towns of hard-line criminals, some of the worst people on earth, people that rape and kill women, people that are killing people just for the sake of having fun.	0
479	Donald Trump	They are being thrown in jails and they are being... all over the country and nobody's ever done it like us, so we are being unbelievably thorough with that.	0
480	Donald Trump	We are out in Long Island cleaning out the MS-13 scum, they are all scum, that's probably the worst gang anywhere on Earth...	0
481	Julie Pace	A lot of the dreamers have been hoping to hear something from you.	0
482	Julie Pace	I don't want to give them the wrong message with this.	0
483	Donald Trump	Here is what they can hear: The dreamers should rest easy.	0
484	Donald Trump	OK?	0
485	Donald Trump	I'll give you that. The dreamers should rest easy...	0
486	SYSTEM	[An aide talks about Trump's address to Congress]	0
487	Donald Trump	A lot of the people have said that, some people said it was the single best speech ever made in that chamber.	0
488	Julie Pace	You seem like you enjoyed it.	0
489	Donald Trump	I did.	0
490	Donald Trump	I did.	0
491	Donald Trump	I believed in it and I enjoyed it.	0
492	Donald Trump	It was a great feeling to introduce the wife of a great young soldier who died getting us very valuable information.	0
493	Donald Trump	Have you seen the tremendous success?...	0
494	Donald Trump	That's another thing that nobody talks about.	0
495	Donald Trump	Have you seen the tremendous success we've had in the Middle East with the ISIS? When	0
496	SYSTEM	[Haider al]	0
497	Donald Trump	Abadi left from Iraq, he said Trump has more success in eight weeks than Obama had in eight years.... We have had tremendous success, but we don't talk about it.	0
498	Donald Trump	We don't talk about it.	0
499	Julie Pace	Do you mean you don't talk about it personally because you don't want to talk about it?	0
500	Donald Trump	I don't talk about it.	0
501	Donald Trump	No.	0
502	Donald Trump	And the generals don't talk about it.	0
503	Julie Pace	You had put a request into the Pentagon to put forward an ISIS plan within 30 days.	0
504	Julie Pace	I know they have sent that over.	0
505	Julie Pace	Have you accepted a plan?	0
506	Julie Pace	Are you moving forward on a strategy?	0
507	Donald Trump	We have a very strong plan, but we cannot talk about it, Julie.	0
508	Julie Pace	So you have decided on a plan?	0
509	Donald Trump	Remember how many times have you been to the speech where I talked about Mosul.	0
510	Julie Pace	Right.	0
511	Donald Trump	Right.	0
512	Donald Trump	Mosul.	0
513	Donald Trump	Four months we are going in, three months.	0
514	Donald Trump	We are still fighting Mosul.	0
515	Donald Trump	You know why?	0
516	Donald Trump	Because they were prepared.	0
517	Donald Trump	If we would have gone in and just done it, it would have been over three months ago.	0
518	Julie Pace	Can you say generally what the strategy is?	0
519	Julie Pace	Should people --	0
520	Donald Trump	Generally is we have got to get rid of ISIS.	0
521	Donald Trump	We have no choice.	0
522	Donald Trump	And other terrorist organizations.	0
523	Julie Pace	Should Americans who are serving in the military expect that you are going to increase troop numbers in the Middle East to fight ISIS?	0
524	Donald Trump	No, not much.	0
525	Julie Pace	In terms of the strategy, though, that you have accepted, it sounds like, from the generals --	0
526	Donald Trump	Well, they've also accepted my strategy.	0
527	Julie Pace	Does that involve more troops on the ground, it sounds like?	0
528	Donald Trump	Not many.	0
529	Julie Pace	So a small increase?	0
530	Donald Trump	It could be an increase, then an increase.	0
531	Donald Trump	But not many more.	0
532	Donald Trump	I want to do the job, but not many more....	0
533	Donald Trump	This is an important story.	0
534	Donald Trump	I've done a lot.	0
535	Donald Trump	I've done more than any other president in the first 100 days and I think the first 100 days is an artificial barrier.	1
536	Donald Trump	And I'm scheduled... the foundations have been set to do some great things.	0
537	Donald Trump	With foreign countries.	0
538	Donald Trump	Look at, look at President Xi.	0
539	Donald Trump	I mean ...	0
540	Julie Pace	What do you think it was about your chemistry?	0
541	Donald Trump	We had good chemistry.	0
542	Donald Trump	Now I don't know that I think that's going to produce results but you've got a good chance.	0
543	Julie Pace	Uh-huh.	0
544	Donald Trump	Look, he turned down many coal ships.	0
545	Donald Trump	These massive coal ships are coming where they get a lot of their income.	0
546	Donald Trump	They're coming into China and they're being turned away.	0
547	Donald Trump	That's never happened before.	0
548	Donald Trump	The fuel, the oil, so many different things.	0
549	Donald Trump	You saw the editorial they had in their paper saying they cannot be allowed to have nuclear, you know, et cetera.	0
550	Donald Trump	People have said they've never seen this ever before in China.	0
551	Donald Trump	We have the same relationship with others.	0
552	Donald Trump	There's a great foundation that's built.	0
553	Donald Trump	Great foundation.	0
554	Donald Trump	And I think it's going to produce tremendous results for our country.	0
555	Julie Pace	One more 100 days question.	0
556	Donald Trump	That's fine.	0
557	Julie Pace	... is do you think you have the right team in place for your next 100 days?	0
558	Donald Trump	Yes.	0
559	Donald Trump	I think my team has been, well, I have different teams.	0
560	Donald Trump	I think my military team has been treated with great respect.	0
561	Donald Trump	As they should be.	0
562	Donald Trump	I think my other team hasn't been treated with the respect that they should get.	0
563	Donald Trump	We have some very talented people, and very diverse people.	0
564	Julie Pace	Do you mean your White House team when you say that?	0
565	Donald Trump	Yeah, my White House team.	0
566	Donald Trump	I think Reince has been doing an excellent job.	0
567	Donald Trump	I think that, you know, this is a very tough environment not caused necessarily by me.	0
568	Donald Trump	Although the election has, you know, look, the Democrats had a tremendous opportunity because the electoral college, as I said, is so skewed to them.	0
569	Donald Trump	You start off by losing in New York and California, no matter who it is.	0
570	Donald Trump	If, if Abe Lincoln came back to life, he would lose New York and he would lose California.	0
571	Donald Trump	It's just the registration, there's nothing you can do.	0
572	Donald Trump	So you're losing the two biggest states, that's where you start.	0
573	Donald Trump	OK.	0
574	Donald Trump	The Electoral College is so skewed in favor of a Democrat that it's very, very hard.	0
575	Donald Trump	Look at Obama's number in the Electoral College.	0
576	Donald Trump	His numbers on the win were... but the Electoral College numbers were massive.	0
577	Donald Trump	You lose New York, you lose Illinois.	0
578	Donald Trump	Illinois is impossible to win.	0
579	Donald Trump	And you look at, so now you lose New York, Illinois, no matter what you do, and California.	0
580	Donald Trump	Right.	0
581	Donald Trump	And you say, man.	0
582	Donald Trump	Now you have to win Florida, you have to win Ohio, you have to win North Carolina.	0
583	Donald Trump	You have to win all these states, and then I won Wisconsin and Michigan and all of these other places, but you remember there was no way to, there was no way to 270.	0
584	Julie Pace	Right.	0
585	Donald Trump	So she had this massive advantage, she spent hundreds of millions of dollars more money than I spent.	0
586	Donald Trump	Hundreds of millions... Yeah.	0
587	Donald Trump	Or more, actually because we were $375 she was at $2.2 billion.	0
588	Donald Trump	But whatever.	0
589	Donald Trump	She spent massive amounts of money more and she lost.	0
590	Donald Trump	Solidly lost, because you know it wasn't 270, it was 306.	0
591	Donald Trump	So there's anger.	0
592	Donald Trump	But there was massive anger before I got there, so it's not easy for a White House staff to realize that you are going into a situation where you are going to be at no, where are going to get no votes.	0
593	Donald Trump	I mean, here's a judge who is No.	0
594	Donald Trump	1 at Columbia, No.	0
595	Donald Trump	1 at Harvard and an Oxford scholar.	0
596	Donald Trump	And he got three votes.	0
597	Julie Pace	Three Democratic votes, but yeah.	0
598	Donald Trump	Three Democratic votes.	0
599	Donald Trump	OK.	0
600	Donald Trump	He's an Oxford scholar at the highest level.	0
601	Donald Trump	The No.	0
602	Donald Trump	1, you know, one of the great academics, one of the great writers.	0
603	Donald Trump	No bad decisions with all... nothing.	0
604	Donald Trump	He's like a ...	0
605	Julie Pace	Do you think that you can break through that?	0
606	Julie Pace	I mean this --	0
607	Donald Trump	Yeah, I do.	0
608	Julie Pace	Is one of the biggest challenges for a president.	0
609	Donald Trump	I think I can to an extent.	0
610	Donald Trump	But there's a, there's a basic hard-line core that you can't break though, OK, that you can't break through.	0
611	Donald Trump	There's a hard-line group you can't break through, you can't.	0
612	Donald Trump	It's sad.	0
613	Donald Trump	You can't.	0
614	Donald Trump	Look, I met with Congressman Cummings and I really liked him, a lot.	0
615	Donald Trump	Elijah Cummings.	0
616	Donald Trump	I really liked him a lot.	0
617	Donald Trump	And during the conversation because we have a very strong mutual feeling on drug prices.	0
618	Donald Trump	He came to see me, at my invitation, because I saw him talking about, he came to see me about drug prices because drug prices are ridiculous.	0
619	Donald Trump	And I am going to get them way, way, way down and he liked that.	0
620	Donald Trump	He said you will be the greatest president.	0
621	Donald Trump	He said you will be, in front of five, six people, he said you will be the greatest president in the history of this country.	0
622	Julie Pace	He disputed that slightly.	0
623	Donald Trump	That's what he said.	0
624	Donald Trump	I mean, what can I tell you?	0
625	Julie Pace	Yeah.	0
626	Donald Trump	There's six people sitting here.	0
627	Donald Trump	What did he, what, what do you mean by slightly?	0
628	Julie Pace	He said, he said that he felt like you could be a great president if and then --	0
629	Donald Trump	Well he said, you'll be the greatest president in the history of, but you know what, I'll take that also, but that you could be.	0
630	Donald Trump	But he said, will be the greatest president but I would also accept the other.	0
631	Donald Trump	In other words, if you do your job, but I accept that.	0
632	Donald Trump	Then I watched him interviewed and it was like he never even was here.	0
633	Donald Trump	It's incredible.	0
634	Donald Trump	I watched him interviewed a week later and it's like he was never in my office.	0
635	Donald Trump	And you can even say that.	0
636	Julie Pace	And that's one of the difficulties I think presidents have had is that you can have these personal relationships with people from the other party, but then it's hard to actually change how people vote or change how people --	0
637	Donald Trump	No I have, it's interesting, I have, seem to get very high ratings.	0
638	Donald Trump	I definitely.	0
639	Donald Trump	You know Chris Wallace had 9.2 million people, it's the highest in the history of the show.	0
640	Donald Trump	I have all the ratings for all those morning shows.	0
641	Donald Trump	When I go, they go double, triple.	0
642	Donald Trump	Chris Wallace, look back during the Army-Navy football game, I did his show that morning.	0
643	Julie Pace	I remember, right.	0
644	Donald Trump	It had 9.2 million people.	0
645	Donald Trump	It's the highest they've ever had. On any, on air,	0
646	SYSTEM	[John]	0
647	Donald Trump	Dickerson had 5.2 million people.	0
648	Donald Trump	It's the highest for "Face the Nation" or as I call it, "Deface the Nation."	0
649	Donald Trump	It's the highest for "Deface the Nation" since the World Trade Center.	0
650	Donald Trump	Since the World Trade Center came down.	0
651	Donald Trump	It's a tremendous advantage.	0
652	Donald Trump	I have learned one thing, because I get treated very unfairly, that's what I call it, the fake media.	0
653	Donald Trump	And the fake media is not all of the media.	0
654	Donald Trump	You know they tried to say that the fake media was all the, no.	0
655	Donald Trump	The fake media is some of you.	0
656	Donald Trump	I could tell you who it is, 100 percent.	0
657	Donald Trump	Sometimes you're fake, but -- but the fake media is some of the media.	0
658	Donald Trump	It bears no relationship to the truth.	0
659	Donald Trump	It's not that Fox treats me well, it's that Fox is the most accurate.	0
660	Julie Pace	Do you believe that?	0
661	Julie Pace	That Fox --	0
662	Donald Trump	I do.	0
663	Donald Trump	I get treated so badly.	0
664	Donald Trump	Yesterday, about the thing, you know when I said it's a terrorism... it may be.	0
665	Donald Trump	I said it may be a terrorist attack and MSNBC, I heard, went crazy, "He called it a terrorist attack."	0
666	Donald Trump	They thought it was a bank robbery.	0
667	Donald Trump	By the way, I'm 10-0 for that.	0
668	Donald Trump	I've called every one of them.	0
669	Donald Trump	Every time they said I called it way too early and then it turns out I'm... Whatever.	0
670	Donald Trump	Whatever.	0
671	Donald Trump	In the meantime, I'm here and they're not.	0
672	Julie Pace	Do you feel that one of the things with cable is there's such real-time reaction with everything you say?	0
673	Donald Trump	Yeah.	0
674	Julie Pace	Can you separate that sometimes from that actual decision?	0
675	Donald Trump	The one thing --	0
676	Julie Pace	That you have to do --	0
677	Donald Trump	OK.	0
678	Donald Trump	The one thing I've learned to do that I never thought I had the ability to do.	0
679	Donald Trump	I don't watch CNN anymore.	0
680	Julie Pace	You just said you did.	0
681	Donald Trump	No. No, I, if I'm passing it, what did I just say	0
682	SYSTEM	[Inaudible]	0
683	Donald Trump	?	0
684	Julie Pace	You just said --	0
685	Donald Trump	Where?	0
686	Donald Trump	Where?	0
687	Julie Pace	Two minutes ago.	0
688	Donald Trump	No, they treat me so badly.	0
