501	LESLEY STAHL	I'm n-- I'm not talking about Democrat-- I'm talking about the country.	0
502	LESLEY STAHL	You go out and you go to Mississippi.	0
503	TRUMP	The famous Mississippi speech?	0
504	LESLEY STAHL	And you mimicked Professor Blasey Ford.	0
505	LESLEY STAHL	You mimicked her.	0
506	TRUMP	Had I not made that speech, we would not have won.	0
507	TRUMP	I was just saying she didn't seem to know anything.	0
508	LESLEY STAHL	No (Inaudible.)--	0
509	TRUMP	And you're trying to destroy a life of a man who has been extraordinary.	0
510	LESLEY STAHL	Why did you have to make fun of her?	0
511	TRUMP	I didn't really make fun of her.	0
512	LESLEY STAHL	Well, they were laughing.	0
513	TRUMP	What I said the person that we're talking about didn't know the year, the time, the place.	0
514	LESLEY STAHL	Professor Blasey Ford got before the Senate and-- and was asked what's the worst moment.	0
515	LESLEY STAHL	And she said, "When the two boys laughed at me, at my expense."	0
516	TRUMP	Ok, fine.	0
517	LESLEY STAHL	And then I watched you mimic her and thousands of people were laughing at her.	0
518	TRUMP	They can do what they-- I-- I will tell you this.	0
519	TRUMP	The way now Justice Kavanaugh was treated has become a big factor in the midterms.	0
520	TRUMP	Have you seen what's gone on with the polls?	0
521	LESLEY STAHL	But did you have to--	0
522	TRUMP	Well, I think she was treated with great respect, I'll-- I'll--	0
523	LESLEY STAHL	And-- but--	0
524	TRUMP	be honest with you.	0
525	LESLEY STAHL	but do you think—you treated her with--	0
526	TRUMP	There are those that think she shouldn't have--	0
527	LESLEY STAHL	Do you think you treated her with respect?	0
528	TRUMP	I think so, yeah.	0
529	TRUMP	I did.	0
530	LESLEY STAHL	But you seem to be saying that she lied.	0
531	TRUMP	W-- you know what?	0
532	TRUMP	I'm not gonna get into it because we won.	0
533	TRUMP	It doesn't matter.	0
534	TRUMP	We won.	0
535	LESLEY STAHL	The anonymous column that ran in "The New York Times."	0
536	LESLEY STAHL	The author, we don't know who it is.	0
537	LESLEY STAHL	Whoever it is.	0
538	TRUMP	Whoever it is.	0
539	TRUMP	Maybe it was "The New York Times" too.	0
540	LESLEY STAHL	Paints a picture.	0
541	TRUMP	No, no, it's --By the way, you don't know how dishonest "The New York Times" is.	0
542	TRUMP	It could've been "The New York Times."	0
543	TRUMP	I doubt it.	0
544	TRUMP	But it could've been.	0
545	LESLEY STAHL	Okay.	0
546	LESLEY STAHL	I doubt it too.	0
547	TRUMP	It also could've been any-- w-- well, don't count on it.	0
548	TRUMP	It also could've been any one of 3,000 people.	0
549	LESLEY STAHL	You have said that this administration is like a smooth-running machine.	0
550	LESLEY STAHL	And yet, we keep hearing that the White House is in chaos.	0
551	TRUMP	It's-- wrong, it's so false.	0
552	TRUMP	It's fake news.	0
553	TRUMP	I'm changing things around.	0
554	TRUMP	And I'm entitled to.	0
555	TRUMP	I have people now on standby that will be phenomenal.	0
556	TRUMP	They'll come into the administration, they'll be phenomenal.	0
557	LESLEY STAHL	More people gonna go?	0
558	TRUMP	Yeah, other people will go, sure.	0
559	LESLEY STAHL	Cause so many people, you have kind of a record of --on turnover.	0
560	TRUMP	I think I have a great Cabinet.	0
561	TRUMP	There're some people that I'm not happy with.	0
562	LESLEY STAHL	Who are you not happy with?	0
563	TRUMP	No, I don't wanna say that but	0
564	LESLEY STAHL	Come on.	0
565	TRUMP	Not I don't want to say that.	0
566	LESLEY STAHL	What about General Mattis?	0
567	LESLEY STAHL	Is he going to leave?	0
568	TRUMP	Well, I don't know.	0
569	TRUMP	He hasn't told me that.	0
570	TRUMP	I have--	0
571	LESLEY STAHL	Do you want him to--	0
572	TRUMP	--a very good relationship with him.	0
573	TRUMP	It could be that he is.	0
574	TRUMP	I think he's sort of a Democrat, if you wanna know the truth.	0
575	TRUMP	But General Mattis is a good guy.	0
576	TRUMP	We get along very well.	0
577	TRUMP	He may leave.	0
578	TRUMP	I mean, at some point, everybody leaves.	0
579	TRUMP	Everybody.	0
580	TRUMP	People leave.	0
581	TRUMP	That's Washington.	0
582	LESLEY STAHL	The first lady, Melania.	0
583	LESLEY STAHL	She said that there are still people in the White House that she doesn't trust and that you shouldn't trust.	0
584	TRUMP	I feel the same way.	0
585	TRUMP	I don't trust everybody in the White House, I'll be honest with you.	0
586	LESLEY STAHL	You go to a meeting, do you have to wonder, "Is he wearing a wire--"	0
587	TRUMP	I'm usually --	0
588	LESLEY STAHL	–or whatever?	0
589	TRUMP	Not so much a wire.	0
590	TRUMP	I'm usually guarded.	0
591	TRUMP	And I think I'm guarded anyway.	0
592	TRUMP	But I'm not saying I trust everybody in the White House.	0
593	TRUMP	I'm not a baby.	0
594	TRUMP	It's a tough business.	0
595	TRUMP	This is a r-- this is a vicious place.	0
596	TRUMP	Washington DC is a vicious, vicious place.	0
597	TRUMP	The attacks, the-- the bad mouthing, the speaking behind your back.	0
598	TRUMP	--but-- you know, and in my way, I feel very comfortable here.	0
599	LESLEY STAHL	It takes a president a while to find his sea legs.	0
600	TRUMP	I think so.	0
601	TRUMP	I mean, I felt comfortable at the beginning, other than it was a little surreal to say I'm the president of the United States, but I think that's true with everybody.	0
602	LESLEY STAHL	POTUS.	0
603	TRUMP	Now I very much feel like POTUS.	0
604	TRUMP	I do.	0
605	TRUMP	I feel like the president.	0
606	TRUMP	You know, for a little while, it's like-- "Mr. President, sir."	0
607	TRUMP	It's-- even my friends, they call me, they-- they don't call me Donald-- they call me Mr. President.	0
608	TRUMP	And I say, "Will you please loosen up?"	0
609	TRUMP	I've learned on the job.	0
610	TRUMP	I have.	0
611	LESLEY STAHL	And you feel comfortable?	0
612	TRUMP	I feel very comfortable, yeah.	0
