1	STEPHANOPOULOS	The stage is set.	0
2	STEPHANOPOULOS	The field has been narrowed.	0
3	STEPHANOPOULOS	For one night only, the top 10 candidates are here.	0
4	STEPHANOPOULOS	Our Democratic primary debate starts right now.	0
5	SYSTEM	(BEGIN VIDEO CLIP)	0
6	ANNOUNCER	This is an ABC News special.	0
7	BIDEN	I will be a president for every American.	0
8	WARREN	This is our moment.	0
9	SANDERS	We are in a struggle for the future of this country.	0
10	HARRIS	We fight for our country.	0
11	HARRIS	That's the nature of who we are.	0
12	SANDERS	Right now we can act.	0
13	YANG	We're in the midst of the greatest economic transformation.	0
14	BOOKER	We have overcome worse times and darker moments than this.	0
15	O'ROURKE	We will make the most of this moment that we have here together.	0
16	KLOBUCHAR	We are on a march together.	0
17	CASTRO	We're going to win by being bold.	0
18	CASTRO	We're going to win by being fearless.	0
19	ANNOUNCER	Live from Texas Southern University in Houston, Texas, here now, chief anchor George Stephanopoulos.	0
20	STEPHANOPOULOS	Good evening, and welcome to Houston.	0
21	STEPHANOPOULOS	We are live from Texas Southern University for tonight's Democratic debate.	0
22	STEPHANOPOULOS	The top 10 candidates are here.	0
23	STEPHANOPOULOS	It's going to start right now.	0
24	STEPHANOPOULOS	And on the stage, you see them.	0
25	STEPHANOPOULOS	They have all met the criteria set by the Democratic National Committee.	0
26	STEPHANOPOULOS	At least 10 others have not met the threshold.	0
27	STEPHANOPOULOS	So, for the first time in this primary, a single debate in a single night with all the top candidates facing off.	0
28	STEPHANOPOULOS	It is a critical test for the candidates and their campaigns at a critical time for our country.	0
29	STEPHANOPOULOS	They're going to lay out their vision for the country, their records, their differences with President Trump and each other.	0
30	STEPHANOPOULOS	And we're going to do our best to bring you a lively, informative, and civil debate.	0
31	STEPHANOPOULOS	I'm joined here tonight by my ABC colleague, "World News Tonight" anchor David Muir, our national correspondent, Linsey Davis, and Jorge Ramos from our partner network, Univision.	0
32	STEPHANOPOULOS	Jorge?	0
33	RAMOS	George, thank you very much.	0
34	RAMOS	We appreciate the opportunity to welcome Latinos across the country and to ask about Latinx issues during these challenging times.	0
35	SYSTEM	(SPEAKING SPANISH)	0
36	RAMOS	Let me just give you a little translation here.	0
37	RAMOS	I'm telling Latinos that, despite the fact that we are facing difficult times, this is our country, too.	0
38	RAMOS	Linsey?	0
39	SYSTEM	(APPLAUSE)	0
40	DAVIS	We are delighted to be on the beautiful campus of Texas Southern University, one of the largest historically black colleges and universities in the country.	0
41	DAVIS	And here in the Health and Physical Education Building tonight, we are joined by a live audience of 3,500 people, most invited by the Democratic National Committee, and, of course, some of the brightest minds of the student body here at TSU.	0
42	DAVIS	Go Tigers.	0
43	SYSTEM	(APPLAUSE)	0
44	MUIR	We can feel the energy in the room, can't we, Linsey?	0
45	MUIR	The rules of this debate are very basic tonight and have been agreed to by all the campaigns in advance.	0
46	MUIR	Candidates will have one minute, 15 seconds to answer a direct question and 45 seconds for a rebuttal or response as directed by one of the moderators.	0
47	MUIR	Candidates will each see green and yellow lights -- there you see them right there -- indicating how much time they have remaining.	0
48	MUIR	And when time is up, the light will turn red.	0
49	MUIR	Candidates who interrupt will be subject to having their time reduced later on.	0
50	MUIR	But this is democracy, the great American experiment, and the candidates are here tonight to make their case.	0
51	STEPHANOPOULOS	The podium placement was based on their current standings in nationally recognized polls with the leading candidates in the center.	0
52	STEPHANOPOULOS	All candidates have been told they can have one minute to make an opening statement.	0
53	STEPHANOPOULOS	And we're going to begin in reverse polling order with Secretary Julian Castro.	0
54	SYSTEM	(APPLAUSE)	0
55	CASTRO	Good evening, y bienvenidos a Texas.	0
56	CASTRO	Welcome to Texas.	0
57	SYSTEM	(APPLAUSE)	0
58	CASTRO	It's great to be here at TSU, home of the Tigers.	0
59	CASTRO	You know, on January 20, 2021, at 12:01 p.m., we're going to have a Democratic president, a Democratic House, and a Democratic Senate.	0
60	SYSTEM	(APPLAUSE)	0
61	CASTRO	There will be life after Donald Trump.	0
62	CASTRO	But the truth is that our problems didn't start just with Donald Trump, and we won't solve them by embracing old ideas.	0
63	CASTRO	We need a bold vision: universal pre-K and universal health care, unleashing millions of new jobs in the clean energy economy, a tax system that rewards people who have to work for a living.	0
64	CASTRO	But first, we have to win.	0
65	CASTRO	And that means exciting a young, diverse coalition of Americans who are ready for a bold future.	0
66	CASTRO	That's what Kennedy did, it's what Carter did, it's what Clinton did, it's what Barack Obama did, and it's what I can do in this race.	0
67	CASTRO	Get back Michigan, Wisconsin, and Pennsylvania, Florida, Georgia, and Arizona, and finally turn Texas blue and say goodbye to Donald Trump.	0
68	SYSTEM	(APPLAUSE)	0
69	STEPHANOPOULOS	Senator Klobuchar?	0
70	KLOBUCHAR	Good evening, Texas Southern.	0
71	KLOBUCHAR	I believe that what unites us up here, the 10 of us, is much stronger than what divides us.	0
72	KLOBUCHAR	And I think that's true of our country, too.	0
73	KLOBUCHAR	Now, I may not be the loudest person up here, but I think we've already got that in the White House.	0
74	SYSTEM	(APPLAUSE)	0
75	KLOBUCHAR	Houston, we have a problem.	0
76	KLOBUCHAR	This -- we have a guy there that is literally running our country like a game show.	0
77	KLOBUCHAR	He would rather lie than lead.	0
78	KLOBUCHAR	I think we need something different.	0
79	KLOBUCHAR	I am someone that tells the truth.	0
80	KLOBUCHAR	I don't make promises that I can't keep.	0
81	KLOBUCHAR	I have people's back.	0
82	KLOBUCHAR	And I believe that to win, you bring people with you and that is how you govern, as well.	0
83	KLOBUCHAR	So, you're going to hear a lot of ideas up here.	0
84	KLOBUCHAR	Some will be great.	0
85	KLOBUCHAR	But if you see that some of them seem a little off-track, I've got a better way.	0
86	KLOBUCHAR	If you feel stuck in the middle of the extremes in our politics and you are tired of the noise and the nonsense, you've got a home with me, because I don't want to be the president for half of America.	0
87	KLOBUCHAR	I want to be the president for all of America.	0
88	SYSTEM	(APPLAUSE)	0
89	STEPHANOPOULOS	Congressman Beto O'Rourke?	0
90	O'ROURKE	It's an honor to be on this debate stage.	0
91	O'ROURKE	It is wonderful to be back in Texas, in Houston, back here at TSU.	0
92	O'ROURKE	On August 3rd, in El Paso, Texas, two things became crystal clear for me, and I think produced a turning point for this country.	0
93	O'ROURKE	The first is just how dangerous Donald Trump is, the cost and the consequence of his presidency.	0
94	O'ROURKE	A racism and violence that had long been a part of America was welcomed out into the open and directed to my hometown of El Paso, Texas, where 22 people were killed, dozens more grievously injured by a man carrying a weapon he should never have been able to buy in the first place, inspired to kill by our president.	0
95	O'ROURKE	The second is how insufficient our politics is to meet the threat that we have right now.	0
96	O'ROURKE	The bitterness, the pettiness, the smallness of the moment, the incentives to attack one another and try to make differences without distinctions, mountains out of mole hills, we have to be bigger.	0
97	O'ROURKE	We have to see clearly, we have to speak honestly, and we have to act decisively.	0
98	O'ROURKE	That's what I want to do for you as president of the United States.	0
99	O'ROURKE	Thank you.	0
100	SYSTEM	(APPLAUSE)	0
101	STEPHANOPOULOS	Senator Cory Booker?	0
102	BOOKER	It was over 20 years ago that I was a law student and moved to inner city Newark, New Jersey, to serve as a tenants rights lawyer to try to address the challenges in my community.	0
103	BOOKER	And I was sobered by them -- the gun violence, the sub-standard housing.	0
104	BOOKER	But it was my greatest mentor, a woman named Ms. Virginia Jones, who challenged me.	0
105	BOOKER	She said, boy, if all you see in this neighborhood is problems, that's all there's ever going to be.	0
106	BOOKER	But if you're stubborn and defiant and can put forth a vision that can unify people, then we can make transformative change.	0
107	BOOKER	She was a church woman that said, without vision, the people will perish.	0
108	BOOKER	Well, that's exactly what we did.	0
109	BOOKER	We created extraordinary unity in our community, and we did things that other people think -- thought was impossible.	0
110	BOOKER	That's the story of America.	0
111	BOOKER	At our best, we unify, we find common cause and common purpose.	0
112	BOOKER	The differences amongst us Democrats on the stage are not as great as the urgency for us to unite as a party, not just to beat Donald Trump, but to unite America in common cause and common purpose.	0
113	BOOKER	That's why I'm running for president, and that's how I will lead this nation.	0
114	SYSTEM	(APPLAUSE)	0
115	STEPHANOPOULOS	Entrepreneur Andrew Yang?	0
116	YANG	In America today, everything revolves around the almighty dollar -- our schools, our hospitals, our media, even our government.	0
117	YANG	It's why we don't trust our institutions anymore.	0
118	YANG	We have to get our country working for us again, instead of the other way around.	0
119	YANG	We have to see ourselves as the owners and shareholders of this democracy rather than inputs into a giant machine.	0
120	SYSTEM	(APPLAUSE)	0
121	YANG	When you donate money to a presidential campaign, what happens?	0
122	YANG	The politician spends the money on TV ads and consultants and you hope it works out.	0
123	YANG	It's time to trust ourselves more than our politicians.	0
124	YANG	That's why I'm going to do something unprecedented tonight.	0
125	YANG	My campaign will now give a freedom dividend of $1,000 a month for an entire year to 10 American families, someone watching this at home right now.	0
126	YANG	If you believe that you can solve your own problems better than any politician, go to yang2020.com and tell us how $1,000 a month will help you do just that.	0
127	YANG	This is how we will get our country working for us again, the American people.	0
128	SYSTEM	(APPLAUSE)	0
129	STEPHANOPOULOS	Mayor Pete Buttigieg?	0
130	BUTTIGIEG	It's original, I'll give you that.	0
131	BUTTIGIEG	The American people are divided and doubtful at the very moment we need to rise to some of the greatest challenges we've ever seen.	0
132	BUTTIGIEG	As a mayor of an industrial city coming back from the brink, as a veteran of the war in Afghanistan, I know what's at stake in our national leadership.	0
133	BUTTIGIEG	We keep sending politicians to Washington asking them to fight for us, but then when they get there, they seem more interested in the part about fighting than the part about us.	0
134	BUTTIGIEG	Good politics is supposed to be not about the day-to-day fights of the politicians, but about the day-to-day lives of Americans.	0
135	BUTTIGIEG	We just marked the anniversary of 9/11.	0
136	BUTTIGIEG	All day today, I've been thinking about September 12th, the way it felt when for a moment we came together as a country.	0
137	BUTTIGIEG	Imagine if we had been able to sustain that unity.	0
138	BUTTIGIEG	Imagine what would be possible right now with ideas that are bold enough to meet the challenges of our time, but big enough, as well, that they could unify the American people.	0
139	BUTTIGIEG	That's what presidential leadership can do.	0
140	BUTTIGIEG	That's what the presidency is for.	0
141	BUTTIGIEG	And that is why I'm asking for your vote.	0
142	SYSTEM	(APPLAUSE)	0
143	STEPHANOPOULOS	Senator Kamala Harris?	0
144	HARRIS	Thank you.	0
145	HARRIS	It's great to be back at TSU.	0
146	HARRIS	So I plan on spending tonight talking with you about my plans to address the problems that keep you up at night.	0
147	HARRIS	But first, I have a few words for Donald Trump, who we all know is watching.	0
148	SYSTEM	(LAUGHTER)	0
149	HARRIS	So, President Trump, you've spent the last two-and-a-half years full-time trying to sow hate and division among us, and that is why we've gotten nothing done.	0
150	HARRIS	You have used hate, intimidation, fear, and over 12,000 lies as a way to distract from your failed policies and your broken promises.	0
151	HARRIS	The only reason you've not been indicted is because there was a memo in the Department of Justice that says a sitting president cannot be charged with a crime.	0
152	HARRIS	But here's what you don't get: What you don't get you is that the American people are so much better than this.	0
153	HARRIS	And we know that the vast majority of us have so much more in common than what separates us, regardless of our race, where we live, or the party with which we're registered to vote.	0
154	HARRIS	And I plan on focusing on our common issues, our common hopes and desires, and in that way, unifying our country, winning this election, and turning the page for America.	0
155	HARRIS	And now, President Trump, you can go back to watching Fox News.	0
156	SYSTEM	(APPLAUSE)	0
157	STEPHANOPOULOS	Senator Bernie Sanders?	0
158	STEPHANOPOULOS	Senator Sanders?	0
159	SANDERS	Let me be blunt and tell you what you don't hear much about in Congress or in the media, and that is, it goes without saying that we must and will defeat Trump, the most dangerous president in the history of this country.	0
160	SYSTEM	(APPLAUSE)	0
161	SANDERS	But we must do more.	0
162	SANDERS	We must do more.	0
163	SANDERS	We have got to recognize that this country is moving into an oligarchic form of society where a handful of billionaires control the economic and political life of this country.	0
164	SANDERS	And as president, I am prepared to take them on.	0
165	SANDERS	Yes, we will raise the minimum wage to a living wage.	0
166	SANDERS	Yes, we will finally make sure that every American has health care as a human right, not a privilege.	0
167	SANDERS	And, yes, we will address the catastrophic crisis of climate change and transform our energy system away from fossil fuel.	0
168	SYSTEM	(APPLAUSE)	0
169	STEPHANOPOULOS	Senator Elizabeth Warren?	0
170	WARREN	So, I was born and raised in Oklahoma, but I'm sure glad to be in Texas tonight.	0
171	SYSTEM	(APPLAUSE)	0
172	WARREN	All three of my brothers served in military bases here in Texas.	0
173	WARREN	That was their ticket to the middle class.	0
174	WARREN	Me, I got my big opportunity about a half-mile down the road from here at the University of Houston, back when it cost $50 a semester.	0
175	SYSTEM	(APPLAUSE)	0
176	WARREN	For a price that I could pay for, on a part-time waitressing job, I got to finish my four-year degree and I became a special needs teacher.	0
177	WARREN	And after law school, my first big job was back here in Houston.	0
178	WARREN	By then, I had two little kids, and when childcare nearly brought me down, my Aunt Bee moved in and saved us all.	0
179	WARREN	The paths to America's middle class have gotten a lot smaller and a lot narrower.	0
180	WARREN	Today, service-members are preyed upon by predatory lenders.	0
181	WARREN	Students are crushed by debt.	0
182	WARREN	And families cannot afford childcare.	0
183	SYSTEM	(APPLAUSE)	0
184	WARREN	I know what's broken.	0
185	WARREN	I know how to fix it.	0
186	WARREN	And I'm going to lead the fight to get it done.	0
187	SYSTEM	(APPLAUSE)	0
188	STEPHANOPOULOS	Vice President Joe Biden.	0
189	JOE BIDEN (D), FORMER VICE PRESIDENT, PRESIDENTIAL CANDIDATE	You know, when President Kennedy announced the moon shot, he used a phrase that sticks with me my whole life.	0
190	JOE BIDEN (D), FORMER VICE PRESIDENT, PRESIDENTIAL CANDIDATE	He said, we're doing it because we refuse to postpone.	0
191	JOE BIDEN (D), FORMER VICE PRESIDENT, PRESIDENTIAL CANDIDATE	Well, I refuse to postpone one more minute spending billions of dollars on curing cancer, Alzheimer's, and other diseases which, if we invest in them, we can find cures.	0
192	JOE BIDEN (D), FORMER VICE PRESIDENT, PRESIDENTIAL CANDIDATE	I refuse to postpone giving single child in America, no matter their zip code, pre-K all the way through high school and beyond.	0
193	JOE BIDEN (D), FORMER VICE PRESIDENT, PRESIDENTIAL CANDIDATE	I refuse to postpone any longer taking on climate change and leading the world in taking on climate change.	0
194	JOE BIDEN (D), FORMER VICE PRESIDENT, PRESIDENTIAL CANDIDATE	Look, this is the United States of America.	0
195	JOE BIDEN (D), FORMER VICE PRESIDENT, PRESIDENTIAL CANDIDATE	There has never been a single solitary time when we've set our mind to something we've been unable to do it.	0
196	JOE BIDEN (D), FORMER VICE PRESIDENT, PRESIDENTIAL CANDIDATE	We're walking around with our heads down like woe is me.	0
197	JOE BIDEN (D), FORMER VICE PRESIDENT, PRESIDENTIAL CANDIDATE	We're the best-equipped nation in the world to take this on.	0
198	JOE BIDEN (D), FORMER VICE PRESIDENT, PRESIDENTIAL CANDIDATE	It's no longer time to postpone.	0
199	JOE BIDEN (D), FORMER VICE PRESIDENT, PRESIDENTIAL CANDIDATE	We should get moving.	0
200	JOE BIDEN (D), FORMER VICE PRESIDENT, PRESIDENTIAL CANDIDATE	There's enormous, enormous opportunities once we get rid of Donald Trump.	0
201	SYSTEM	(APPLAUSE)	0
202	STEPHANOPOULOS	Candidates, thank you.	0
203	STEPHANOPOULOS	Several of you said you are more united than divided, and that is certainly true.	0
204	STEPHANOPOULOS	All of you agree on one big thing, the goal of defeating President Trump, driving the country in a new direction.	0
205	STEPHANOPOULOS	But out on the campaign trail, you have outlined big differences over how far to go and how fast to go.	0
206	STEPHANOPOULOS	And, Vice President Biden, the differences between you and the senators on either side of you tonight strike at the heart of this primary debate.	0
207	STEPHANOPOULOS	Both senators Warren and Sanders want to replace Obamacare with Medicare for All.	0
208	STEPHANOPOULOS	You want to build on Obamacare, not scrap it.	0
209	STEPHANOPOULOS	They propose spending far more than you to combat climate change and tackle student loan debt.	0
210	STEPHANOPOULOS	And they would raise more in taxes than you to pay for their programs.	0
211	STEPHANOPOULOS	Are senators Warren and Sanders pushing too far beyond where Democrats want to go and where the country needs to go?	0
212	BIDEN	That will be for the voters to decide that question.	0
213	BIDEN	Let me tell you what I think.	0
214	BIDEN	I think we should have a debate on health care.	0
215	BIDEN	I think -- I know that the senator says she's for Bernie, well, I'm for Barack.	0
216	BIDEN	I think the Obamacare worked.	0
217	BIDEN	I think the way we add to it, replace everything that has been cut, add a public option, guarantee that everyone will be able to have affordable insurance, number one.	0
218	BIDEN	Number two, I think we should be in a position of taking a look at what costs are.	0
219	BIDEN	My plan for health care costs a lot of money.	0
220	BIDEN	It costs $740 billion.	0
221	BIDEN	It doesn't cost $30 trillion, $3.4 trillion a year, it turns out, is twice what the entire federal budget is.	0
222	BIDEN	That's before -- exists now, without interest on the debt.	0
223	BIDEN	How are we going to pay for it?	0
224	BIDEN	I want to hear that tonight how that's happened.	0
225	BIDEN	Thus far, my distinguished friend, the senator on my left, has not indicated how she pays for it.	0
226	BIDEN	And the senator has, in fact, come forward and said how he's going to pay for it, but it gets him about halfway there.	0
227	BIDEN	There's a lot of other things that need to be done.	0
228	BIDEN	I have a bold plan to deal with making sure we triple the money for at-risk schools that are Title I schools, from 15 to $45 billion a year.	0
229	BIDEN	But I go down the line and these are things we're talking about, I lay out how I can pay for it, how I can get it done, and why it's better.	0
230	STEPHANOPOULOS	Senator Warren, let me take that to you, particularly on what Senator Biden was saying there about health care.	0
231	STEPHANOPOULOS	He has actually praised Bernie Sanders for being candid about his health care plan, that Senator -- says that Sanders has been candid about the fact that middle class taxes are going to go up and most of private insurance is going to be eliminated.	0
232	STEPHANOPOULOS	Will you make that same admission?	0
233	WARREN	So, let's be clear about health care.	0
234	WARREN	And let's actually start where vice president did.	0
235	WARREN	We all owe a huge debt to President Obama, who fundamentally transformed health care in America and committed this country to health care for every human being.	0
236	SYSTEM	(APPLAUSE)	0
237	WARREN	And now the question is, how best can we improve on it?	0
238	WARREN	And I believe the best way we can do that is we make sure that everybody gets covered by health care at the lowest possible cost.	0
239	WARREN	How do we pay for it?	0
240	WARREN	We pay for it, those at the very top, the richest individuals and the biggest corporations, are going to pay more.	0
241	WARREN	And middle class families are going to pay less.	0
242	WARREN	That's how this is going to work.	0
243	SYSTEM	(APPLAUSE)	0
244	STEPHANOPOULOS	Direct question.	0
245	STEPHANOPOULOS	You said middle class families are going to pay less.	0
246	STEPHANOPOULOS	But will middle class taxes go up to pail for pay for the program?	0
247	STEPHANOPOULOS	I know you believe that the deductibles and the premiums will go down.	0
248	STEPHANOPOULOS	Will middle class taxes go up?	0
249	STEPHANOPOULOS	Will private insurance be eliminated?	0
250	WARREN	Look, what families have to deal with is cost, total cost.	0
251	WARREN	That's what they have to deal with.	0
252	WARREN	And understand, families are paying for their health care today.	0
253	WARREN	Families pay every time an insurance company says, sorry, you can't see that specialist.	0
254	WARREN	Every time an insurance company says, sorry, that doctor is out of network, sorry, we are not covering that prescription.	0
255	WARREN	Families are paying every time they don't get a prescription filled because they can't pay for it.	0
256	WARREN	They don't have a lump checked out because they can't afford the co-pay.	0
257	WARREN	What we're talking about here is what's going to happen in families' pockets, what's going to happen in their budgets.	0
258	WARREN	And the answer is on Medicare for All, costs are going to go up for wealthier individuals and costs are going to go up for giant corporations.	0
259	WARREN	But for hard-working families across this country, costs are going to go down and that's how it should work under Medicare for All in our health care system.	0
260	SYSTEM	(APPLAUSE)	0
261	STEPHANOPOULOS	Senator Sanders, you were invoked by the vice president, also take on that question about taxes.	0
262	SANDERS	Well, Joe said that Medicare for All would cost over $30 trillion.	0
263	SANDERS	That's right, Joe.	0
264	SANDERS	Status quo over 10 years will be $50 trillion.	0
265	SANDERS	Every study done shows that Medicare for All is the most cost-effective approach to providing health care to every man, woman, and child in this country.	0
266	SANDERS	I, who wrote the damn bill, if I may say so...	0
267	SYSTEM	(APPLAUSE)	0
268	SANDERS	... intend to eliminate all out-of-pocket expenses, all deductibles, all co-payments.	0
269	SANDERS	Nobody in America will pay more than $200 a year for prescription drugs, because we're going to stand up to the greed and corruption and price-fixing of the pharmaceutical industry.	0
270	SYSTEM	(APPLAUSE)	0
271	SANDERS	We need -- we need a health care system that guarantees health care to all people as every other major country does, not a system which provides $100 billion a year in profit for the drug companies and the insurance companies.	0
272	SANDERS	And I'll tell you how absurd the system is tonight on ABC, the health care industry will be advertising, telling you how bad Medicare for All is, because they want to protect their profits.	0
273	SANDERS	That is absurd.	0
274	SYSTEM	(APPLAUSE)	0
275	STEPHANOPOULOS	Vice president Biden...	0
276	KLOBUCHAR	If I could respond, George.	0
277	STEPHANOPOULOS	You get a response and then we're going to broaden out the discussion.	0
278	BIDEN	OK, number one, my health care plan does significantly cut the costs of -- the largest out-of-pocket payment you'll pay is $1,000.	0
279	BIDEN	You'll be able to get into a -- anyone who can't afford it gets automatically enrolled in the Medicare-type option we have, et cetera.	0
280	BIDEN	But guess what?	0
281	BIDEN	Of the 160 million people who like their health care now, they can keep it.	0
282	BIDEN	If they don't like it, they can leave.	0
283	BIDEN	Number one.	0
284	BIDEN	Number two, the fact of the matter is, we're in a situation where, if you notice, he hasn't answered the question.	0
285	BIDEN	This is about candor, honesty, big ideas.	0
286	BIDEN	Let's have a big idea.	0
287	BIDEN	The tax of 2 percent that the senator is talking about, that raises about $3 billion.	0
288	BIDEN	Guess what?	0
289	BIDEN	That leaves you $28 billion short.	0
290	BIDEN	The senator said before, it's going to cost you in your pay -- there will be a deductible, in your paycheck.	0
291	BIDEN	You're going to -- the middle class person, someone making 60 grand with three kids, they're going to end up paying $5,000 more.	0
292	BIDEN	They're going to end up paying 4 percent more on their income tax.	0
293	BIDEN	That's a reality.	0
