880	BOOKER	You know, if that was the attitude when Strom Thurmond had the longest filibuster ever on civil rights, if it was this idea that we can't get it done because of the situation in the Senate, I'm looking to lead a movement.	0
881	BOOKER	The number-one reason why governments are formed is to protect the citizenry.	0
882	BOOKER	Think about this.	0
883	BOOKER	We have had more people die due to gun violence in my lifetime than every single war in this country combined, from the Revolutionary War until now.	0
884	BOOKER	This is not a side issue to me.	0
885	BOOKER	It is a central issue to me.	0
886	BOOKER	That is the kind of fight -- because the majority of homicide victims -- we have a mass shooting every single day in communities like mine.	0
887	BOOKER	We must awaken a more courageous empathy in this country so that we stand together and fight together and overwhelm those Republicans who are not even representing their constituency.	0
888	BOOKER	Because the majority of Americans, the majority of gun-owners agree with me, not the corporate gun lobby.	0
889	BOOKER	It is time for a movement on this issue, and I will lead it.	0
890	SYSTEM	(APPLAUSE)	0
891	BIDEN	Go beat them (ph).	0
892	MUIR	Senator Booker, thank you.	0
893	MUIR	Senator Warren, I want to come to you next, because you have actually said in recent days that there are things you can get done with Republicans in the Senate.	0
894	MUIR	What can you get done on gun control?	0
895	WARREN	So let's start by framing the problem the right way.	0
896	WARREN	We have a gun violence problem in this country.	0
897	WARREN	The mass shootings are terrible, but they get all the headlines.	0
898	WARREN	Children die every day on streets, in neighborhoods, on playgrounds.	0
899	WARREN	People die from violence, from suicide and domestic abuse.	0
900	WARREN	We have a gun violence problem in this country.	0
901	WARREN	And we agree on many steps we could take to fix it.	0
902	WARREN	My view on this is, we're going to -- it's not going to be one and done on this.	0
903	WARREN	We're going to do it, and we're going to have to do it again, and we're going to have to come back some more until we cut the number of gun deaths in this country significantly.	0
904	WARREN	But here's the deal.	0
905	WARREN	The question we need to ask is, when we've got this much support across the country, 90 percent of Americans want to see us do -- I like registration -- want to see us do background checks, want to get assault weapons off the streets, why doesn't it happen?	0
906	WARREN	And the answer is corruption, pure and simple.	0
907	SYSTEM	(APPLAUSE)	0
908	WARREN	We have a Congress that is beholden to the gun industry.	0
909	WARREN	And unless we're willing to address that head-on and roll back the filibuster, we're not going to get anything done on guns.	0
910	WARREN	I was in the United States Senate when 54 senators said let's do background checks, let's get rid of assault weapons, and with 54 senators, it failed because of the filibuster.	1
911	WARREN	Until we attack the systemic problems, we can't get gun reform in this country.	0
912	WARREN	We've got to go straight against the industry and we've got to change Congress, so it doesn't just work for the wealthy and well-connected, so it works for the people.	0
913	SYSTEM	(APPLAUSE)	0
914	MUIR	Senator Warren, thank you.	0
915	MUIR	You bring up eliminating the filibuster, which means you would need simply a simple majority in a Republican Senate to get something done.	0
916	MUIR	I want to turn to Senator Sanders on this, because you've said before of this, if Donald Trump supports ending the filibuster, which he's talked about himself, you should be nervous.	0
917	MUIR	Would you support ending the filibuster?	0
918	SANDERS	No.	0
919	SANDERS	But what I would support, absolutely, is passing major legislation, the gun legislation the people here are talking about, Medicare for all, climate change legislation that saves the planet.	0
920	SANDERS	I will not wait for 60 votes to make that happen, and you can do it in a variety of ways.	0
921	SANDERS	You can do that through budget reconciliation law.	0
922	SANDERS	You have a vice president who will, in fact, tell the Senate what is appropriate and what is not, what is in order and what is not.	0
923	SANDERS	But I want to get back to a point that Elizabeth made and that, in fact, in terms of gun issues, picking up on Cory and Beto and everybody else, what we are looking at is a corrupt political system, and that means whether it is the drug companies or the insurance companies or the fossil fuel industry determining what's happening in Washington or, in this case, you've got an NRA which has intimidated the president of the United States and the Republican leadership.	0
924	SYSTEM	(APPLAUSE)	0
925	SANDERS	I am proud -- I am proud that, year after year, I had an "F" rating from the NRA.	0
926	SANDERS	And as president, I will not be intimidated by the NRA.	0
927	MUIR	Senator Sanders, thank you.	0
928	HARRIS	May I respond...	0
929	RAMOS	We've been hearing a lot about what's been happening here in Texas.	0
930	RAMOS	Only a few weeks ago, the deadliest massacre of Latinos, Latinos, in modern U.S. history happened in this state, in El Paso.	0
931	RAMOS	So the fear among Latinos -- and you know this -- is very real.	0
932	RAMOS	So let me start with an issue that is causing a lot of division in this country: immigration.	0
933	RAMOS	Vice President Biden, as a presidential candidate, in 2008, you supported the border wall, saying, "Unlike most Democrats, I voted for 700 miles of fence."	0
934	RAMOS	This is what you said.	0
935	RAMOS	Then you served as vice president in an administration that deported 3 million people, the most ever in U.S. history.	0
936	RAMOS	Did you do anything to prevent those deportations?	0
937	RAMOS	I mean, you've been asked this question before and refused to answer, so let me try once again.	0
938	RAMOS	Are you prepared to say tonight that you and President Obama made a mistake about deportations?	0
939	RAMOS	Why should Latinos trust you?	0
940	BIDEN	What Latinos should look at is -- comparing this president to the president we have is outrageous, number one.	0
941	BIDEN	We didn't lock people up in cages.	1
942	BIDEN	We didn't separate families.	1
943	BIDEN	We didn't do all of those things, number one.	0
944	BIDEN	Number two -- number two, by the time -- this is a president who came along with the DACA program.	0
945	BIDEN	No one had ever done that before.	0
946	BIDEN	This is the president that sent legislation to the desk saying he wants to find a pathway for the 11 million undocumented in the United States of America.	0
947	BIDEN	This is a president who's done a great deal.	0
948	BIDEN	So I'm proud to have served with him.	0
949	BIDEN	What I would do as president is several more things, because things have changed.	0
950	BIDEN	I would, in fact, make sure that there is -- we immediately surge to the border.	0
951	BIDEN	All those people who are seeking asylum, they deserve to be heard.	0
952	BIDEN	That's who we are.	0
953	BIDEN	We're a nation who says, if you want to flee, and you're freeing oppression, you should come.	0
954	BIDEN	I would change the order that the president just changed, saying women who were being beaten and abused could no longer claim that as a reason for asylum.	0
955	BIDEN	And by the way, retrospectively, you know, the 25th anniversary of the Violence Against Women Act is up.	0
956	BIDEN	The Republican Congress has not reauthorized it.	0
957	BIDEN	Let's put pressure on them to pass the Violence Against Women Act.	0
958	BIDEN	Now (inaudible) back...	0
959	RAMOS	Yeah, but you didn't answer the question.	0
960	BIDEN	Well, I did answer the question.	0
961	RAMOS	No, did you make a mistake with those deportations?	0
962	BIDEN	The president did the best thing that was able to be done at the time.	0
963	RAMOS	How about you?	0
964	BIDEN	I'm the vice president of the United States.	0
965	RAMOS	Secretary Castro, would you want to respond to Vice President Biden?	0
966	CASTRO	I mean, look...	0
967	RAMOS	And let me put this in context, because your party controlled the White House and Congress in 2009 and didn't pass immigration reform, and this broke a promise made by President Barack Obama to Latinos.	0
968	RAMOS	So why should voters trust Democrats now?	0
969	RAMOS	I mean, now it is even more difficult, as you know, because you need Republican votes in the Senate.	0
970	RAMOS	So are you willing, for instance, to give up DACA or give up a path to citizenship or even agree to build a wall in order to legalize 10.5 million undocumented immigrants?	0
971	CASTRO	Jorge, thank you very much for that question.	0
972	CASTRO	And, look, I agree that Barack Obama was very different from Donald Trump.	0
973	CASTRO	Donald Trump has a dark heart when it comes to immigrants.	0
974	CASTRO	He built his whole political career so far on scapegoating and fearmongering and otherizing migrants, and that's very different from Barack Obama.	0
975	CASTRO	But my problem with Vice President Biden -- and Cory pointed this out last time -- is every time something good about Barack Obama comes up, he says, oh, I was there, I was there, I was there, that's me, too, and then every time somebody questions part of the administration that we were both part of, he says, well, that was the president.	0
976	CASTRO	I mean, he wants to take credit for Obama's work, but not have to answer to any questions.	0
977	CASTRO	I mean...	0
978	SYSTEM	(APPLAUSE)	0
979	RAMOS	Vice President Biden, you have -- you have 45 seconds.	0
980	CASTRO	Let me just say...	0
981	BIDEN	That's not what I said.	0
982	CASTRO	Let me just say...	0
983	BIDEN	That's not what I said.	0
984	CASTRO	Jorge, let me just say that I would -- I was the first candidate in early April to put forward an immigration plan.	0
985	CASTRO	You know why?	0
986	CASTRO	Because I'm not afraid of Donald Trump on this issue.	0
987	CASTRO	I'm not going to back pedal.	0
988	CASTRO	I'm not going to pretend like I don't have my own vision for immigration.	0
989	CASTRO	So we're not going to give up DACA.	0
990	CASTRO	We're not going to give up protections for anybody.	0
991	CASTRO	I believe that on January 20, 2021, we're going to have a Democratic president, we're going to throw out Mitch McConnell and John Cornyn and have a Democratic Senate, and a Democratic House, and we're going to pass immigration reform within the first 100 days.	0
992	RAMOS	Vice President, 45 seconds.	0
993	BIDEN	I did not say I don't -- I stand with Barack Obama all eight years, good, bad and indifferent.	0
994	BIDEN	That's where I stand.	0
995	BIDEN	I did not say I did not stand with him.	0
996	RAMOS	OK, Senator Warren, hundreds of children have been separated from their parents at the border.	0
997	RAMOS	And recently, in Mississippi, we saw the largest immigration raid in a decade.	0
998	RAMOS	You want ICE, the agency in charge of rounding up undocumented immigrants.	0
999	RAMOS	So how would you deal with the millions of immigrants who arrive legally but overstay their visas?	0
1000	RAMOS	And how would you stop hundreds of thousands of Central Americans who want to migrate to the U.S.?	0
1001	WARREN	Well, I start with a statement of principles, and that is, in this country, immigration does not make us weaker, immigration makes us stronger.	0
1002	SYSTEM	(APPLAUSE)	0
1003	WARREN	I want to see us expand legal immigration and create a pathway to citizenship for our DREAMers, but also for their grandparents, and for their cousins, for people who have overstayed student visas, and for people who came here to work in the fields.	0
1004	WARREN	I want to have a system that is a path to citizenship that is fair and achievable.	0
1005	WARREN	Down at the border, we've got to rework this entirely.	0
1006	WARREN	A system right now that cannot tell the difference in the threat posed by a terrorist, a criminal, and a 12-year-old girl is not a system that is keeping us safer, and it is not serving our values.	0
1007	SYSTEM	(APPLAUSE)	0
1008	RAMOS	Mr. Yang...	0
1009	WARREN	We need -- I want to add one more part on this, because I think we have to look at all the pieces.	0
1010	WARREN	Why do we have a crisis at the border?	0
1011	WARREN	In no small part because we have withdrawn help from people in Central America who are suffering.	0
1012	SYSTEM	(APPLAUSE)	0
1013	WARREN	We need to restore that help.	0
1014	WARREN	We need to help establish and re-establish the rule of law so that people don't feel like they have to flee for their lives.	0
1015	WARREN	We have a crisis that Donald Trump has created and hopes to profit from politically.	0
1016	WARREN	We have to have the courage to stand up and fight back.	0
1017	SYSTEM	(APPLAUSE)	0
1018	RAMOS	Mr. Yang?	0
1019	RAMOS	It is true that in the last few years we have seen the most severe anti-immigrant measures, from putting kids in cages to limiting asylum for people fleeing gangs and domestic violence.	0
1020	RAMOS	But it is also true about 1 million immigrants enter the U.S. legally every year.	0
1021	RAMOS	So, are you willing to raise the number of legal immigrants from 1 million to 2 million per year?	0
1022	RAMOS	And should there be a merit system, as President Trump wants?	0
1023	WARREN	So, yes -- oh, I'm sorry.	0
1024	WARREN	Did you me or...	0
1025	YANG	It was me.	0
1026	WARREN	Oh, he said it.	0
1027	WARREN	OK.	0
1028	WARREN	Sorry.	0
1029	YANG	My -- my father grew up on a peanut farm in Asia with no floor and now his son is running for president.	0
1030	YANG	That is the immigration story that we have...	0
1031	SYSTEM	(APPLAUSE)	0
1032	YANG	... to be able to share with the American people.	0
1033	YANG	If you look at our history, almost half of Fortune 500 companies were founded by either immigrants or children of immigrants.	0
1034	YANG	And rates of business formation are much higher in immigrant communities.	0
1035	YANG	We have to say to the American people, immigrants are positive for our economic and social dynamism, and I would return the level of legal immigration to the point it was under the Obama-Biden administration.	0
1036	YANG	I think we have to compete for talent and I am the opposite of Donald Trump in many ways.	0
1037	YANG	He says, build a wall.	0
1038	YANG	I'm going to say to immigrants, come to America, because if you come here, your son our daughter can run for president.	0
1039	YANG	The water is great.	0
1040	YANG	And this is where you want to build a company, build a family, and build a life.	0
1041	YANG	This country has been a magnet for human capital for generations.	0
1042	YANG	If we lose that, we lose something integral to our continued success.	0
1043	YANG	And that is where I would lead as president.	0
1044	SYSTEM	(APPLAUSE)	0
1045	SYSTEM	(SPEAKING SPANISH)	0
1046	BUTTIGIEG	Gracias.	0
1047	RAMOS	(INAUDIBLE) Pete, eight out of 10 Latinos in Texas for another mass shooter targeting them.	0
1048	RAMOS	This is according to a new Univision poll.	0
1049	RAMOS	President Trump has called Mexican immigrants rapists and killers, tried to ban Muslims from entering the country separated children from their parents.	0
1050	RAMOS	He supporters have chanted, build a wall and send her back.	0
1051	RAMOS	Do you think that people who support President Trump and his immigration policies are racist?	0
1052	BUTTIGIEG	Anyone who supports this is supporting racism.	0
1053	SYSTEM	(APPLAUSE)	0
1054	SYSTEM	(SPEAKING SPANISH)	0
1055	BUTTIGIEG	The only people, though, who actually buy into this president's hateful rhetoric around immigrants are people who don't know any.	0
1056	BUTTIGIEG	We have an opportunity to build an American majority around immigration reform.	0
1057	BUTTIGIEG	In my community, a group of conservative Republicans rallied around an individual, a beloved local individual who was deported when he went into ICE to try to get his paperwork sorted out, because they never thought it would happen to him.	0
1058	BUTTIGIEG	In some of the most conservative, rural areas of Iowa, I have seen communities that embraced immigration grow.	0
1059	BUTTIGIEG	And that's why part of my plan for revitalizing the economies of rural America includes community renewal visas that would allow cities and towns and counties that are hurting not only for jobs but for population to embrace immigration as we have in my city.	0
1060	BUTTIGIEG	You know, the only reason that South Bend is growing right now, after years of shrinking, is immigration.	0
1061	BUTTIGIEG	It's one of the reasons we acted, not waiting for Washington, to create city-issued municipal IDs, so that people, regardless of immigration status in our city, had the opportunity to have the benefits of identification.	0
1062	BUTTIGIEG	We have an opportunity to actually get something done.	0
1063	BUTTIGIEG	But we cannot allow this continue to be the same debate with the same arguments and the same clever lines often among the same people since the last real reform happened in the 1980s.	0
1064	BUTTIGIEG	We have to actually engage the American majority around the opportunities for not just growth in small communities, but our values.	0
1065	BUTTIGIEG	Values of welcome, values of faith that all argue for us to manage this humanely and in a way that marries our values with our laws.	0
1066	SYSTEM	(SPEAKING SPANISH)	0
1067	RAMOS	In an interview eight months ago, you were asked to asked what to do with the so-called "over-stayers," people who come with a visa and then stay.	0
1068	RAMOS	And you said, I don't know.	0
1069	RAMOS	Do you have an answer now?	0
1070	O'ROURKE	I do.	0
1071	O'ROURKE	And if you read the rest of that article in The Washington Post, I talked about harmonizing our entry/exit system with Mexico in the same way that we do with Canada.	0
1072	O'ROURKE	I think that could help us to keep a handle on visa over-stays.	0
1073	O'ROURKE	But I think the larger question that we're trying to get at is, how do we rewrite this country's immigration laws in our own image?	0
1074	O'ROURKE	In the image of Houston, Texas, the most diverse city in the United States of America.	0
1075	SYSTEM	(APPLAUSE)	0
1076	O'ROURKE	In the image of El Paso, Texas, one of the safest cities in the United States of America.	0
1077	O'ROURKE	Safe, not despite the fact that we are a city of immigrants, safe because we are a city of immigrants.	0
1078	SYSTEM	(SPEAKING SPANISH)	0
1079	SYSTEM	(APPLAUSE)	0
1080	O'ROURKE	I will lead an effort to make sure that we rewrite our immigration laws in that way.	0
1081	O'ROURKE	Never cage another child.	0
1082	O'ROURKE	Make sure that there is accountability and justice for the seven lives lost under our care and our custody, but also face the fact that Democrats and Republicans alike voted to build a wall that has produced thousands of deaths of people trying to cross to join family or to work a job.	0
1083	O'ROURKE	That we have been part of deporting people, hundreds of thousands just in the Obama administration alone, who posed no threat to this country, breaking up their families.	0
1084	O'ROURKE	Democrats have to get off the back foot, we have to lead on this issue, because we know it is right.	0
1085	O'ROURKE	Legalize America, begin with those more than 1 million DREAMers, make them U.S. citizens right now in this, their true home country...	0
1086	SYSTEM	(APPLAUSE)	0
1087	O'ROURKE	... and extend that to their parents, their sisters and their brothers, and ensure that we have a legal, safe, orderly system to come to this country and add to our greatness here.	0
1088	RAMOS	Thank you.	0
1089	RAMOS	George.	0
1090	STEPHANOPOULOS	Jorge, thank you.	0
1091	STEPHANOPOULOS	We're going to take a quick break.	0
1092	STEPHANOPOULOS	When we come back, national security, foreign policy, homeland security, the impact on American jobs and U.S. troops.	0
1093	SYSTEM	(COMMERCIAL BREAK)	0
1094	ANNOUNCER	Live from Texas Southern University in Houston, the "Democratic Debate."	0
1095	STEPHANOPOULOS	Welcome back.	0
1096	STEPHANOPOULOS	We want to turn now to national security and the foreign policy issue that has such a direct impact here at home.	0
1097	STEPHANOPOULOS	The U.S. relationship with China, trade, and President Trump's tariffs.	0
1098	STEPHANOPOULOS	We received more than 100 questions from viewers wanting to know how all of you are going to handle these tariffs.	0
1099	STEPHANOPOULOS	And, Mr. Yang, let me begin with you.	0
1100	STEPHANOPOULOS	Would you repeal the tariffs on your first day in office?	0
1101	STEPHANOPOULOS	And if so, would you risk losing leverage in our trade relationship with China?	0
1102	YANG	I would not repeal the tariffs on day one, but I would let the Chinese know that we need to hammer out a deal, because right now, the tariffs are pummeling producers and farmers in Iowa who have absolutely nothing to do with the imbalances that we have with China.	0
1103	YANG	A CEO friend of mine was in China recently and he said that he saw pirated U.S. intellectual property on worker workstations to the tune of thousands of dollars per head.	0
1104	YANG	And he said, one, how can my workers compete against that?	0
1105	YANG	And, two, think about all the lost revenue to American companies.	0
1106	YANG	So, the imbalances are real.	0
1107	YANG	But we have to let the Chinese know that we recognize that President Trump has pursued an arbitrary and haphazard trade policy that has had victims on both sides.	0
1108	YANG	So, no to repealing the tariffs immediately, but yes to making sure we come to a deal that addresses the concerns of American companies and American producers.	0
1109	STEPHANOPOULOS	Mayor Pete, let me take that question -- let me take that question to you, because you've seen President Trump's tweets.	0
1110	STEPHANOPOULOS	He says what's going to happen here is the Chinese are just going to wait him out so that they can get a Democrat who they can take advantage of.	0
1111	STEPHANOPOULOS	How do you think about China?	0
1112	STEPHANOPOULOS	We've seen President Trump call President Xi both an enemy and a friend.	0
1113	BUTTIGIEG	Well, the president clearly has no strategy.	0
1114	BUTTIGIEG	You know, when I first got into this race, I remember President Trump scoffed and said he'd like to see me making a deal with Xi Jinping.	0
1115	BUTTIGIEG	I'd like to see him making a deal with Xi Jinping.	0
1116	SYSTEM	(LAUGHTER)	0
1117	BUTTIGIEG	Is it just me, or was that supposed to happen in, like, April?	0
1118	BUTTIGIEG	It's one more example of a commitment not made.	0
1119	BUTTIGIEG	When that happens on the international stage, people take note, not just our competitors, our adversaries, but also our allies take note of the inability of the United States to keep its word or follow through on its plans.	0
1120	BUTTIGIEG	And when that happens, there are serious consequences.	0
1121	BUTTIGIEG	We saw it at the G7.	0
1122	BUTTIGIEG	The leaders of some of the greatest powers and economies of the world sitting to talk about one of the greatest challenges in the world, climate change, and there was literally an empty chair where American leadership could have been.	0
1123	BUTTIGIEG	The problem is, this is a moment when American leadership is needed more than ever, whether it's in Hong Kong, where those protesters for democracy need to know that they have a friend in the United States, or anywhere around the world where increasingly we see dictators throwing their weight around.	0
1124	BUTTIGIEG	The world needs America, but it can't be just any America.	0
1125	STEPHANOPOULOS	Would you repeal the tariffs?	0
1126	BUTTIGIEG	I would have a strategy that would include the tariffs as leverage, but it's not about the tariffs.	0
1127	BUTTIGIEG	Look, what's going on right now is a president who has reduced the entire China challenge into a question of tariffs, when what we know is that the tariffs are coming down on us more than anybody else and there's a lack of a bigger strategy.	0
1128	STEPHANOPOULOS	Senator Klobuchar, you've actually supported the tariffs on steel.	0
1129	KLOBUCHAR	What we've got right now, though, George, it's not a focused tariff on steel.	0
1130	KLOBUCHAR	What he has done here, he has assessed these tariffs on our allies.	0
1131	KLOBUCHAR	He has put us in the middle of this trade war and he is treating our farmers and our workers like poker chips in one of his bankrupt casinos.	0
1132	KLOBUCHAR	And if we are not careful, he is going to bankrupt this country.	0
1133	KLOBUCHAR	One forecast recently says that it has already cost us 300,000 jobs, all right?	0
1134	KLOBUCHAR	There is soybeans that are mounting up in bins all over the Midwest, in my state of Minnesota and in Iowa.	0
1135	KLOBUCHAR	So what I think we need to do is to go back to the negotiating table -- that's what I would do.	0
1136	KLOBUCHAR	I wouldn't have put all these tariffs in place.	0
1137	KLOBUCHAR	And I wouldn't have had a trade policy where on August 1st he announces he's going to have tariffs on $300 billion of goods, on August 13th, he cuts it in half, a week later, he says he's going to reduce taxes, the day after that, he says he's going to do it.	0
1138	KLOBUCHAR	The leaders of the world are watching this, and it undermines our strength as a nation.	0
1139	KLOBUCHAR	And, yes, we want fair trade, but we must work with the rest of the world.	0
1140	KLOBUCHAR	And he has made a mockery of focused trade policy, which I think means enforcement, like we've done in northern Minnesota, passing bills, getting President Obama to do more on that, so that our workers can benefit, so we are importing, exporting goods and making sure that it's a competitive policy where our goal is that we are making things, inventing things, and exporting to the world.	0
1141	KLOBUCHAR	He is defeating that goal.	0
1142	STEPHANOPOULOS	Secretary Castro, you actually, in one of the previous debates, identified China as the most serious national security threat to our country.	0
