line_number,speaker,sentence,politifact_statement,verified_claim,verified_claim_article_title,truth_value,verified_claim_url,notes
200,Donald Trump,"But, I mean do you ever see anything -- and then you wonder why CNN is doing relatively poorly in the ratings.","CNN, their ratings are going down.","CNNs ratings are ""way down.""",Trumps Pants on Fire claim that CNN ratings are way down,Pants on Fire!,https://www.politifact.com/truth-o-meter/statements/2017/jul/03/donald-trump/trumps-pants-fire-claim-cnn-ratings-are-way-down/,
254,Donald Trump,"And the other thing -- very important -- I believe wages will start going up, because we now have the lowest unemployment rate we've had in 17 years, so you're going to see wages go up, right?",Wages havent gone up in a long time.,"Wages ""havent gone up for a long time.""","Donald Trump said wages 'havent gone up for a long time,' but that's wrong",FALSE,https://www.politifact.com/truth-o-meter/statements/2017/aug/17/donald-trump/donald-trump-says-wages-havent-gone-long-time-s-wr/,
17,Donald Trump,"The crowds were so big, almost as big as tonight, that the people said right at the beginning, you know, there's something special happening here.","This was the scene of my first rally speech. Right? The crowds were so big, almost as big as tonight.","Despite what Donald Trump claims, ""there werent 15,000 people who turned out in Phoenix"" to see Trump speak.",Rachel Maddow says Donald Trump exaggerated his crowd in Phoenix  Pund,TRUE,https://www.politifact.com/punditfact/statements/2015/jul/15/rachel-maddow/rachel-maddow-says-donald-trump-exaggerated-his-cr/,
114,Donald Trump,The only time they show the crowds is when there's a disrupter or an anarchist in the room.,The only times they show the crowds is when there is a disrupter.,"The media ""never show crowds.""",Trump says the media doesn't show his crowds at rallies. He's wrong,FALSE,https://www.politifact.com/truth-o-meter/statements/2016/nov/03/donald-trump/trump-says-media-doesnt-show-his-crowds-rallies-he/,
500,Donald Trump,"Arizona is a disaster in terms of the price increase of your insurance, 116 percent interest.",Arizona is a disaster in terms of the price increase in terms of insurance. 116 percent increase.,"Obamacare is ""hurting people right now"" with premium increases of up to 116 percent.",Testing Paul Ryan claim on Obamacare premium increases of up to 116 percent  PolitiFact Wisconsin,Mostly True,https://www.politifact.com/wisconsin/statements/2017/feb/03/paul-ryan/testing-paul-ryan-claim-obamacare-premium-increase/,
500,Donald Trump,"Arizona is a disaster in terms of the price increase of your insurance, 116 percent interest.",Arizona is a disaster in terms of the price increase in terms of insurance. 116 percent increase.,Obamacare premiums nationwide have increased by double and triple digits.,#NAME?,Half-True,https://www.politifact.com/truth-o-meter/statements/2017/feb/28/donald-trump/fact-checking-donald-trumps-claim-about-soaring-ob/,
591,Donald Trump,We've also obtained historic increase in defense spending to prevent and deter conflict.,Weve also obtained a historic increase in defense spending.,We've achieved a historic increase in defense spending to get our troops the support they so richly deserve.,"In Youngstown, Trump incorrectly says he has achieved historic increase in defense spending",FALSE,https://www.politifact.com/truth-o-meter/statements/2017/jul/27/donald-trump/its-false-trump-achieved-historic-increase-defense/,
417,Donald Trump,"And in fact, General Kelly, who was in charge of Homeland Security, where people coming in down 78 and almost 80 percent.","Border ""down 78 and almost 80 percent""","The border is down 78 percent. Under past administrations, the border didnt go down -- it went up.",se Trump's claim about illegal immigration under past administrations,FALSE,https://www.politifact.com/truth-o-meter/statements/2017/aug/03/donald-trump/false-trumps-claim-about-illegal-immigration-under/,
319,Donald Trump,"The New York Times essentially apologized after I won the election, because their coverage was so bad, and it was so wrong, and they were losing so many subscribers that they practically apologized.","The New York Times, ""they practically apologized.""",The nytimes sent a letter to their subscribers apologizing for their BAD coverage of me.,Donald Trump says New York Times apologized for 'bad coverage' of him,FALSE,https://www.politifact.com/truth-o-meter/statements/2016/nov/15/donald-trump/donald-trump-says-new-york-times-apologized-bad-co/,
