line_number,speaker,sentence,politifact_statement,verified_claim,verified_claim_article_title,truth_value,verified_claim_url,notes
79,Donald Trump,"As an example, Saudi Arabia put up hundreds of billions of dollars of money going into buying our planes and our military equipment and investing in our country.",Saudi Arabia put up hundreds of billions of dollars of money going into buying our planes and our military equipment and investing in our country.,"Deals struck on his first foreign trip as president made and saved ""millions of jobs.""",Did Donald Trump's trip create or save 'millions' of jobs?,FALSE,https://www.politifact.com/truth-o-meter/statements/2017/may/26/donald-trump/did-donald-trumps-trip-create-or-save-millions-job/,
244,Pat Robertson,"Don't forget, when I came in, one of my first acts was the Keystone Pipeline.","The Keystone Pipeline and the Dakota Access Pipeline will lead to ""thousands of thousands of jobs.""","The State Department says the 42,000 jobs created by the Keystone XL pipeline are ""ongoing, enduring jobs.""","TransCanada CEO says 42,000 Keystone XL pipeline jobs are 'ongoing, enduring'  Pund",FALSE,https://www.politifact.com/punditfact/statements/2014/nov/16/russ-girling/transcanada-ceo-says-42000-keystone-xl-pipeline-jo/,NEED CONTEXT
249,Donald Trump,And it's thousands and thousands of jobs.,"The Keystone Pipeline and the Dakota Access Pipeline will lead to ""thousands of thousands of jobs.""","The State Department says the 42,000 jobs created by the Keystone XL pipeline are ""ongoing, enduring jobs.""","TransCanada CEO says 42,000 Keystone XL pipeline jobs are 'ongoing, enduring'  Pund",FALSE,https://www.politifact.com/punditfact/statements/2014/nov/16/russ-girling/transcanada-ceo-says-42000-keystone-xl-pipeline-jo/,NEED CONTEXT
257,Donald Trump,You had cases where a farm would have a little puddle someplace -- a puddle.,"You had cases where a farm would have a little puddle someplace -- a puddle -- when I grew up we used to call it a puddle, you too probably, and they the federal government considered it a lake. If you touched it bad bad things happened to you and your family. We have given the farmers back their farms.","To abide by Environmental Protection Agency rules when mining or drilling you have ""to take caution not to disturb bodies of water barely bigger than a puddle.""",Marco Rubio says EPA rule covers 'water barely bigger than a puddle'  PolitiFact Florid,Mostly False,https://www.politifact.com/florida/statements/2015/oct/22/marco-rubio/marco-rubio-says-epa-rule-covers-water-barely-bigg/,
257,Donald Trump,You had cases where a farm would have a little puddle someplace -- a puddle.,"You had cases where a farm would have a little puddle someplace -- a puddle -- when I grew up we used to call it a puddle, you too probably, and they the federal government considered it a lake. If you touched it bad bad things happened to you and your family. We have given the farmers back their farms.",The EPA has tried to define a puddle or a drainage ditch on your farm to be navigable waters and thus subject to massive environmental regulations.,Ted Cruz says EPA tried to regulate puddles and drainage ditches  PolitiFact Florid,Mostly False,https://www.politifact.com/florida/statements/2016/mar/31/ted-cruz/ted-cruz-says-epa-tried-regulate-puddles-and-drain/,
313,Donald Trump,"They've been promising it ever since Obamacare, which has failed.","Obamacare ""has failed. It is a failed experiment -- it is totally gone. It is out of business.""",28.2 million Americans are still waiting under Obamacare and remain uninsured!,Sean Spicer tweets misleading Obamacare statis,Half-True,https://www.politifact.com/truth-o-meter/statements/2017/jun/28/sean-spicer/sean-spicer-tweets-misleading-obamacare-statistic/,
313,Donald Trump,"They've been promising it ever since Obamacare, which has failed.","Obamacare ""has failed. It is a failed experiment -- it is totally gone. It is out of business.""","Obamacare ""is in a death spiral.""",Is Obamacare in a 'death spiral'?  Pund,FALSE,https://www.politifact.com/punditfact/statements/2017/mar/26/hugh-hewitt/obamacare-death-spiral/,
314,Donald Trump,It's a failed experiment.,"Obamacare ""has failed. It is a failed experiment -- it is totally gone. It is out of business.""",28.2 million Americans are still waiting under Obamacare and remain uninsured!,Sean Spicer tweets misleading Obamacare statis,Half-True,https://www.politifact.com/truth-o-meter/statements/2017/jun/28/sean-spicer/sean-spicer-tweets-misleading-obamacare-statistic/,WEAK
314,Donald Trump,It's a failed experiment.,"Obamacare ""has failed. It is a failed experiment -- it is totally gone. It is out of business.""","Obamacare ""is in a death spiral.""",Is Obamacare in a 'death spiral'?  Pund,FALSE,https://www.politifact.com/punditfact/statements/2017/mar/26/hugh-hewitt/obamacare-death-spiral/,WEAK
