line_number,speaker,sentence,politifact_statement,verified_claim,verified_claim_article_title,truth_value,verified_claim_url,notes
102,Donald Trump,"And if we're going to give all of this money -- you know, there was very large infrastructure bill that was approved during the Obama administration -- a trillion dollars -- nobody ever saw anything being built.",Infrastructure,"President Obama's American Recovery and Reinvestment Act was a fancy name for almost a trillion-dollar spending bill. The ARRA was supposed to fix our crumbling roads and bridges, but now, ""we have absolutely nothing to show for it.""",x's Eric Bolling exaggerates shortcomings of Barack Obama's stimulus  Pund,Mostly False,https://www.politifact.com/punditfact/statements/2016/nov/29/eric-bolling/foxs-eric-bolling-exaggerates-shortcomings-stimulu/,
102,Donald Trump,"And if we're going to give all of this money -- you know, there was very large infrastructure bill that was approved during the Obama administration -- a trillion dollars -- nobody ever saw anything being built.",Infrastructure,"There was a very large infrastructure bill that was approved during the Obama administration, a trillion dollars. Nobody ever saw anything being built.",Donald Trump's skewed portrayal of Obama's stimulus,Mostly False,https://www.politifact.com/truth-o-meter/statements/2017/apr/04/donald-trump/donald-trumps-skewed-portrayal-obamas-stimulus/,
104,Donald Trump,"They used most of that money -- it went, and they used it on social programs.",Infrastructure,"President Obama's American Recovery and Reinvestment Act was a fancy name for almost a trillion-dollar spending bill. The ARRA was supposed to fix our crumbling roads and bridges, but now, ""we have absolutely nothing to show for it.""",x's Eric Bolling exaggerates shortcomings of Barack Obama's stimulus  Pund,Mostly False,https://www.politifact.com/punditfact/statements/2016/nov/29/eric-bolling/foxs-eric-bolling-exaggerates-shortcomings-stimulu/,
104,Donald Trump,"They used most of that money -- it went, and they used it on social programs.",Infrastructure,"There was a very large infrastructure bill that was approved during the Obama administration, a trillion dollars. Nobody ever saw anything being built.",Donald Trump's skewed portrayal of Obama's stimulus,Mostly False,https://www.politifact.com/truth-o-meter/statements/2017/apr/04/donald-trump/donald-trumps-skewed-portrayal-obamas-stimulus/,
303,Donald Trump,"And we've lost close to 70,000 factories over a relatively short period of time -- 70,000.",Manufacturing jobs,"Since China joined thats another beauty the WTO in 2001, the U.S. has lost many more than 60,000 factories.","Trump Since China joined WTO, U.S. has lost 60,000 factories",Mostly True,https://www.politifact.com/truth-o-meter/statements/2017/mar/24/donald-trump/trump-china-joined-wto-us-has-lost-60000-factories/,
304,Donald Trump,"You wouldn't believe it's possible, Reed, to lose 70,000 factories -- 70,000.",Manufacturing jobs,"Since China joined thats another beauty the WTO in 2001, the U.S. has lost many more than 60,000 factories.","Trump Since China joined WTO, U.S. has lost 60,000 factories",Mostly True,https://www.politifact.com/truth-o-meter/statements/2017/mar/24/donald-trump/trump-china-joined-wto-us-has-lost-60000-factories/,WEAK
306,Donald Trump,"We lost almost 70,000 factories.",Manufacturing jobs,"Since China joined thats another beauty the WTO in 2001, the U.S. has lost many more than 60,000 factories.","Trump Since China joined WTO, U.S. has lost 60,000 factories",Mostly True,https://www.politifact.com/truth-o-meter/statements/2017/mar/24/donald-trump/trump-china-joined-wto-us-has-lost-60000-factories/,
286,Donald Trump,"One of the statistics that to me is just ridiculous -- so the 4.6 sounds good, but when you look for a job, you can't find it and you give up -- you are now considered statistically employed.",Unemployment,"When you look for a job, you can't find it and you give up. You are now considered statistically employed.",Donald Trump flubs how unemployment is calculated,FALSE,https://www.politifact.com/truth-o-meter/statements/2017/apr/04/donald-trump/donald-trump-flubs-how-unemployment-calculated/,
292,Donald Trump,"But when you make your car or when you make your air conditioner, and you think you're going to fire all of our workers and open up a new place in another country, and you're going to come through what will be a very strong border, which is already -- you see what's happened; 61 percent down now in terms of illegal people coming in.",Illegal immigration,"Since the day of my election, we've already cut illegal immigration at the southern border by 61 percent.",Trump says illegal immigration at southern border is down 61 percent since Election Day,Mostly True,https://www.politifact.com/truth-o-meter/statements/2017/mar/22/donald-trump/trump-says-illegal-immigration-down-61-percent-ele/,
